214,GIS,Number One General Mills Boulevard,Minneapolis,MN,55426,United States,763 764 7600,https://www.generalmills.com,Packaged Foods,packaged-foods,Packaged Foods,Consumer Defensive,consumer-defensive,Consumer Defensive,"General Mills, Inc. manufactures and markets branded consumer foods worldwide. The company operates through four segments: North America Retail; International; Pet; and North America Foodservice. It offers grain, ready-to-eat cereals, refrigerated yogurt, soup, meal kits, refrigerated and frozen dough products, dessert and baking mixes, bakery flour, frozen pizza and pizza snacks, snack bars, fruit and salty snacks, ice cream and frozen desserts, nutrition bars, and savory snacks, as well as various organic products, including frozen and shelf-stable vegetables. It also manufactures and markets pet food products, including dog and cat food. The company markets its products under the Annie's, Betty Crocker, Bisquick, Blue Buffalo, Blue Basics, Blue Freedom, Bugles, Cascadian Farm, Cheerios, Chex, Cinnamon Toast Crunch, Cocoa Puffs, Cookie Crisp, EPIC, Fiber One, Fruit by the Foot, Fruit Gushers, Fruit Roll-Ups, Gardetto's, Go-Gurt, Gold Medal, Golden Grahams, Häagen-Dazs, Kitano, Kix, Lärabar, Latina, Lucky Charms, Muir Glen, Nature Valley, Nudges, Oatmeal Crisp, Old El Paso, Pillsbury, Progresso, Raisin Nut Bran, Total, Top Chews Naturals, Totino's, Trix, True Chews, Wanchai Ferry, Wheaties, Wilderness, Yoki, Reese's Puffs, Green Giant, and Yoplait trademarks. It sells its products directly, as well as through broker and distribution arrangements to grocery stores, mass merchandisers, membership stores, natural food chains, e-commerce retailers, commercial and noncommercial foodservice distributors and operators, restaurants, convenience stores, and pet specialty stores, as well as drug, dollar, and discount chains. In addition, the company operates ice cream parlors. General Mills, Inc. was founded in 1866 and is headquartered in Minneapolis, Minnesota.",34000,"{'maxAge': 1, 'name': 'Mr. Jeffrey L. Harmening', 'age': 56, 'title': 'Chairman & CEO', 'yearBorn': 1967, 'fiscalYear': 2023, 'totalPay': 5207453, 'exercisedValue': 1189524, 'unexercisedValue': 25626304}",4,4,5,8,6,1709251200,1703980800,86400,2,63.94,63.72,63.48,64.15,63.94,63.72,63.48,64.15,2.36,0.0369,1712620800,0.5499,3.24,0.134,15.502433,13.643469,1520967,1520967,4137468,3781920,3781920,63.72,63.73,1000,900,36183109632,60.33,90.89,1.7912431,64.3374,69.3511,2.26,0.035345636,USD,48620892160,0.12064,564261282,567889984,13158679,13161932,1705017600,1707955200,0.0232,0.00204,0.78831,3.43,0.0232,583558976,16.486,3.8647943,1685232000,1716854400,1700956800,-0.017,2436999936,4.11,4.67,2.01,2:1,1276041600,2.407,11.886,-0.19175833,0.2689098,0.59,1704758400,NYQ,EQUITY,GIS,GIS,"General Mills, Inc.","General Mills, Inc.",322151400,America/New_York,EST,715ecda3-bb03-3fbf-af13-26d8a6c32193,finmb_274715,-18000000,63.715,76.0,58.0,67.89,68.0,2.9,hold,18,593800000,1.046,4090500096,12650699776,0.298,0.639,20199999488,131.342,34.389,0.07098,0.24601,1758287488,3073700096,0.01,-0.016,0.34417,0.2025,0.18753,USD,1.8487,,,
216,GPC,2999 Wildwood Parkway,Atlanta,GA,30339,United States,678-934-5000,https://www.genpt.com,Specialty Retail,specialty-retail,Specialty Retail,Consumer Cyclical,consumer-cyclical,Consumer Cyclical,"Genuine Parts Company distributes automotive replacement parts, and industrial parts and materials. It operates in two segments: Automotive Parts Group and Industrial Parts Group segments. The company distributes automotive replacement parts for hybrid and electric vehicles, trucks, SUVs, buses, motorcycles, recreational vehicles, farm vehicles, small engines, farm equipment, marine equipment, and heavy duty equipment; and equipment and parts used by repair shops, service stations, fleet operators, automobile and truck dealers, leasing companies, bus and truck lines, mass merchandisers, farms, and individuals. It also distributes industrial replacement parts and related supplies, such as abrasives, adhesives, sealants and tape, bearings, chemicals, cutting tools, electrical, facility maintenance, hose and fittings, hydraulics, janitorial, mechanical power transmission, pneumatics, process pumps and equipment, safety, seals and gaskets, and tools and testing instruments, as well as maintenance, repair, and operation customers in aggregate and cement, automotive, chemical and allied products, equipment and machinery, equipment rental and leasing, fabricated metals, food and beverage, iron and steel, lumber and wood, oil and gas, pulp and paper, and rubber products. In addition, the company provides various services and repairs comprising gearbox and fluid power and process pump assembly and repair, hydraulic drive shaft repair, electrical panel assembly and repair, hose and gasket manufacture and assembly. It operates in the United States, Canada, France, the United Kingdom, Ireland, Germany, Poland, the Netherlands, Belgium, Spain, Portugal, Australia, New Zealand, Mexico, Indonesia, and Singapore. The company was incorporated in 1928 and is headquartered in Atlanta, Georgia.",60000,"{'maxAge': 1, 'name': 'Mr. Paul D. Donahue', 'age': 66, 'title': 'Chairman & CEO', 'yearBorn': 1957, 'fiscalYear': 2023, 'totalPay': 3227392, 'exercisedValue': 0, 'unexercisedValue': 765129}",3,8,6,6,5,1709251200,1703980800,86400,2,149.21,149.3,149.21,150.585,149.21,149.3,149.21,150.585,4.0,0.026800001,1709164800,0.4073,2.76,0.945,16.049305,14.126415,279414,279414,1015408,1244150,1244150,150.01,150.08,1000,800,20877201408,126.35,174.91,0.9041425,141.7804,147.5695,3.8,0.025467461,USD,24901840896,0.05702,138855700,139423008,1543786,1467154,1705017600,1707955200,0.0111,0.00331,0.80402,1.53,0.0127,139423008,31.534,4.7485256,1703980800,1735603200,1703980800,0.258,1316524032,9.33,10.6,2.13,3:2,861062400,1.078,11.593,-0.14054489,0.2689098,1.0,1709164800,NYQ,EQUITY,GPC,GPC,Genuine Parts Company,Genuine Parts Company,322151400,America/New_York,EST,2e50ae82-e546-35a3-bd5e-f0da6b120ddd,finmb_275034,-18000000,149.74,187.0,140.0,156.0,155.0,2.4,buy,9,1102007040,7.904,2148023040,5184581120,0.425,1.227,23090610176,117.378,164.502,0.06519,0.32027,663679616,1435609984,0.263,0.011,0.35904998,0.093030006,0.07721,USD,3.1041,,,
217,GILD,333 Lakeside Drive,Foster City,CA,94404,United States,650 574 3000,https://www.gilead.com,Drug Manufacturers - General,drug-manufacturers-general,Drug Manufacturers - General,Healthcare,healthcare,Healthcare,"Gilead Sciences, Inc., a biopharmaceutical company, discovers, develops, and commercializes medicines in the areas of unmet medical need in the United States, Europe, and internationally. The company provides Biktarvy, Genvoya, Descovy, Odefsey, Truvada, Complera/ Eviplera, Stribild, Sunlencs, and Atripla products for the treatment of HIV/AIDS; Veklury, an injection for intravenous use, for the treatment of COVID-19; and Epclusa, Harvoni, Vemlidy, and Viread for the treatment of viral hepatitis. It also offers Yescarta, Tecartus, and Trodelvy products for the treatment of oncology; Letairis, an oral formulation for the treatment of pulmonary arterial hypertension; and AmBisome, a liposomal formulation for the treatment of serious invasive fungal infections. Gilead Sciences, Inc. has collaboration agreements with Arcus Biosciences, Inc.; Merck Sharp & Dohme Corp.; Pionyr Immunotherapeutics Inc.; Tizona Therapeutics, Inc.; Galapagos NV; Janssen Sciences Ireland Unlimited Company; Japan Tobacco, Inc.; Dragonfly Therapeutics, Inc.; Arcellx, Inc.; Everest Medicines; Merck & Co, Inc.; Tentarix Biotherapeutics Inc.; and Assembly Biosciences, Inc. The company was incorporated in 1987 and is headquartered in Foster City, California.",18000,"{'maxAge': 1, 'name': ""Mr. Daniel P.  O'Day"", 'age': 59, 'title': 'Chairman & CEO', 'yearBorn': 1964, 'fiscalYear': 2022, 'totalPay': 7267338, 'exercisedValue': 0, 'unexercisedValue': 9635551}",3,5,3,1,1,1709251200,1672444800,86400,2,72.31,72.39,72.105,72.6,72.31,72.39,72.105,72.6,3.08,0.042600002,1710374400,0.6667,3.97,0.2,16.056177,9.711398,1987610,1987610,7337525,6932540,6932540,72.23,72.24,800,1200,90035650560,71.37,87.87,3.3203886,78.6266,77.6218,3.0,0.04148804,USD,107305959424,0.20892,1239458539,1245769984,19880222,17135011,1705017600,1707955200,0.016,0.001,0.88642,2.45,0.0178,1246119936,18.325,3.942854,1703980800,1735603200,1703980800,-0.129,5664999936,4.5,7.44,2.01,2:1,1359331200,3.957,8.921,-0.10849464,0.2689098,0.75,1702512000,NMS,EQUITY,GILD,GILD,"Gilead Sciences, Inc.","Gilead Sciences, Inc.",696090600,America/New_York,EST,8659e669-8ec5-3b0f-9929-db5db506231f,finmb_29002,-18000000,72.2528,121.0,69.0,86.25,82.5,2.5,buy,24,8350000128,6.703,12028000256,25657999360,1.153,1.426,27115999232,112.787,21.728,0.09313,0.25538,8501374976,8006000128,-0.131,-0.037,0.77972,0.44358003,0.35648,USD,0.4115,,650 578 9264,
220,GS,200 West Street,New York,NY,10282,United States,212 902 1000,https://www.goldmansachs.com,Capital Markets,capital-markets,Capital Markets,Financial Services,financial-services,Financial Services,"The Goldman Sachs Group, Inc., a financial institution, provides a range of financial services for corporations, financial institutions, governments, and individuals worldwide. It operates through Global Banking & Markets, Asset & Wealth Management, and Platform Solutions segments. The Global Banking & Markets segment provides financial advisory services, including strategic advisory assignments related to mergers and acquisitions, divestitures, corporate defense activities, restructurings, and spin-offs; and relationship lending, and acquisition financing, as well as secured lending, through structured credit and asset-backed lending and involved in financing under securities to resale agreements. This segment also offers client execution activities for cash and derivative instruments; credit and interest rate products; and provision of mortgages, currencies, commodities, and equities related products, as well as underwriting services. The Asset & Wealth Management segment manages assets across various classes, including equity, fixed income, hedge funds, credit funds, private equity, real estate, currencies, and commodities; and provides customized investment advisory solutions, wealth advisory services, personalized financial planning, and private banking services, as well as invests in corporate equity, credit, real estate, and infrastructure assets. The Platform Solutions segment offers credit cards and point-of-sale financing for purchase of goods or services. This segment also provides cash management services, such as deposit-taking and payment solutions for corporate and institutional clients. The Goldman Sachs Group, Inc. was founded in 1869 and is headquartered in New York, New York.",45300,"{'maxAge': 1, 'name': 'Mr. David  Solomon', 'age': 61, 'title': 'Chairman & CEO', 'yearBorn': 1962, 'fiscalYear': 2022, 'totalPay': 9205077, 'exercisedValue': 0, 'unexercisedValue': 0}",5,7,6,6,7,1709251200,1672444800,86400,2,388.1,388.81,386.2,396.57,388.1,388.81,386.2,396.57,11.0,0.028299998,1709078400,0.4591,2.22,1.416,17.216097,10.086109,1206809,1206809,2283373,2201510,2201510,394.21,394.36,1800,900,128128573440,289.36,396.79,2.8330734,384.1288,343.3918,10.5,0.027054882,USD,-186731577344,0.1883,340821915,325563008,3974914,4356525,1705017600,1707955200,0.012200001,0.00519,0.72599,1.58,0.0123000005,326112000,310.247,1.2685376,1703980800,1735603200,1703980800,0.514,7856000000,22.86,39.02,1.17,,,-4.129,,0.08696258,0.2689098,2.75,1709078400,NYQ,EQUITY,GS,GS,"Goldman Sachs Group, Inc. (The)","The Goldman Sachs Group, Inc.",925824600,America/New_York,EST,71a75a16-7c33-358b-bb56-1764255c880a,finmb_398625,-18000000,393.56,506.0,355.0,418.49,419.0,2.3,buy,21,1031744978944,3008.972,,700372025344,1.429,1.546,45226000384,597.241,132.705,0.0055199997,0.07244,,-12586999808,0.649,0.116,0.83158,,0.11572,USD,3.0714,,,
227,HSY,19 East Chocolate Avenue,Hershey,PA,17033,United States,717 534 4200,https://www.thehersheycompany.com,Confectioners,confectioners,Confectioners,Consumer Defensive,consumer-defensive,Consumer Defensive,"The Hershey Company, together with its subsidiaries, engages in the manufacture and sale of confectionery products and pantry items in the United States and internationally. The company operates through three segments: North America Confectionery, North America Salty Snacks, and International. It offers chocolate and non-chocolate confectionery products; gum and mint refreshment products, including mints, chewing gums, and bubble gums; protein bars; pantry items, such as baking ingredients, toppings, beverages, and sundae syrups; and snack items comprising spreads, bars, snack bites, mixes, popcorn, and pretzels. The company provides its products primarily under the Hershey's, Reese's, Kisses, Jolly Rancher, Almond Joy, Brookside, barkTHINS, Cadbury, Good & Plenty, Heath, Kit Kat, Payday, Rolo, Twizzlers, Whoppers, York, Ice Breakers, Breath Savers, Bubble Yum, Lily's, SkinnyPop, Pirates Booty, Dot's Homestyle Pretzels, and ONE Bar brands, as well as under the Pelon Pelo Rico, IO-IO, and Sofit brands. It markets and sells its products to wholesale distributors, chain grocery stores, mass merchandisers, chain drug stores, vending companies, wholesale clubs, convenience stores, dollar stores, concessionaires, and department stores. The company exports its products in approximately 80 countries worldwide. The Hershey Company was founded in 1894 and is headquartered in Hershey, Pennsylvania.",18650,"{'maxAge': 1, 'name': 'Ms. Michele Gross Buck', 'age': 61, 'title': 'Chairman, President & CEO', 'yearBorn': 1962, 'fiscalYear': 2022, 'totalPay': 5850728, 'exercisedValue': 2039986, 'unexercisedValue': 34000784}",4,9,6,10,10,1709251200,1672444800,86400,2,188.05,186.77,181.16,186.62,188.05,186.77,181.16,186.62,5.48,0.0291,1708041600,0.4918,1.96,0.339,20.16777,17.896181,1631118,1631118,1696896,1661140,1661140,182.7,182.87,800,1000,37265743872,178.82,276.88,3.3377316,190.656,211.99825,4.456,0.023695825,USD,43076497408,0.16675,146366725,149336000,2582478,2543892,1705017600,1707955200,0.0126,0.00266,0.80737996,1.36,0.019199999,203950000,20.055,9.110945,1703980800,1735603200,1703980800,-0.119,1861787008,9.06,10.21,3.37,2:1,1087344000,3.858,14.592,-0.21606636,0.2689098,1.37,1708041600,NYQ,EQUITY,HSY,HSY,The Hershey Company,The Hershey Company,322151400,America/New_York,EST,40d8e0c9-bf7f-3432-8f37-196ba1a93230,finmb_98873,-18000000,182.72,238.0,183.0,212.57,210.0,2.7,hold,21,401902016,1.971,2952032000,5125612032,0.407,0.968,11164991488,125.043,54.533,0.13851,0.50328,1028696256,2323190016,-0.115,0.002,0.44768003,0.2644,0.16936001,USD,3.18,,717 534 7464,
229,HPE,1701 East Mossy Oaks Road,Spring,TX,77389,United States,678 259 9860,https://www.hpe.com,Communication Equipment,communication-equipment,Communication Equipment,Technology,technology,Technology,"Hewlett Packard Enterprise Company provides solutions that allow customers to capture, analyze, and act upon data seamlessly in the Americas, Europe, the Middle East, Africa, the Asia Pacific, and Japan. It operates in six segments: Compute, HPC & AI, Storage, Intelligent Edge, Financial Services, and Corporate Investments and Other. The company offers general purpose servers for multi-workload computing and workload-optimized servers; HPE ProLiant rack and tower servers; HPE Synergy; HPE Alletra, HPE GreenLake, Zerto, HPE InfoSight, and HPE CloudPhysics storage products; HPE Cray EX, HPE Cray XD, and converged edge systems; and HPE Superdome Flex, HPE Nonstop, and HPE Integrity products. It also provides HPE Aruba products that includes hardware products, such as Wi-Fi access points, switches, and gateways; HPE Aruba Networking software and services comprising cloud-based management, network management and access control, analytics and assurance, software-defined wide-area networking, network security, analytics and assurance, and location services software; and professional and support services, as well as as-a-service and consumption models. In addition, the company offers leasing, financing, IT consumption, and utility programs and asset management services for customers to facilitate technology deployment models and the acquisition of various IT solutions, including hardware, software, and services from Hewlett Packard Enterprise and others; consultative-led services; HPE Ezmeral Container Platform; HPE Ezmeral Software Container Platform and HPE Ezmeral Software Data Fabric; OpsRamp; and Hewlett Packard Labs. It serves commercial and large enterprise groups, such as business and public sector enterprises; and through various partners comprising resellers, distribution partners, original equipment manufacturers, independent software vendors, systems integrators, and advisory firms. The company was founded in 1939 and is headquartered in Spring, Texas.",62000,"{'maxAge': 1, 'name': 'Mr. Antonio Fabio Neri', 'age': 56, 'title': 'CEO, President & Director', 'yearBorn': 1967, 'fiscalYear': 2023, 'totalPay': 4488746, 'exercisedValue': 0, 'unexercisedValue': 0}",5,1,5,5,2,1709251200,1703980800,86400,2,15.56,15.81,15.76,17.28,15.56,15.81,15.76,17.28,0.52,0.0334,1710374400,0.3117,3.41,1.201,11.113636,8.308252,25431889,25431889,12055085,14256030,14256030,17.1,17.11,1300,3100,22246590464,13.655,18.135,0.7922293,15.848,16.3427,0.49,0.031491004,USD,29319000064,0.06805,1292772000,1299830016,30623487,28499277,1705017600,1707955200,0.023599999,0.00599,0.83578,3.06,0.0269,1299830016,16.474,1.0389097,1698710400,1730332800,1706659200,-0.228,1911000064,1.54,2.06,2.93,1289:1000,1504224000,1.044,5.893,0.027062654,0.2689098,0.13,1702339200,NYQ,EQUITY,HPE,HPE,Hewlett Packard Enterprise Comp,Hewlett Packard Enterprise Company,1445261400,America/New_York,EST,3cd9b23e-d311-30b2-abcb-cc8c9a1dc8c0,finmb_273983758,-18000000,17.115,20.0,14.0,17.19,17.0,2.7,hold,13,3758000128,2.891,4975000064,12796999680,0.493,0.894,28081000448,59.61,21.605,0.025810001,0.09203,1917250048,5320999936,-0.237,-0.135,0.35658002,0.17717,0.08335,USD,1.1719,,,
242,IBM,One New Orchard Road,Armonk,NY,10504,United States,914 499 1900,https://www.ibm.com,Information Technology Services,information-technology-services,Information Technology Services,Technology,technology,Technology,"International Business Machines Corporation, together with its subsidiaries, provides integrated solutions and services worldwide. The company operates through Software, Consulting, Infrastructure, and Financing segments. The Software segment offers a hybrid cloud and AI platforms that allows clients to realize their digital and AI transformations across the applications, data, and environments in which they operate. The Consulting segment focuses on skills integration for strategy, experience, technology, and operations by domain and industry. The Infrastructure segment provides on-premises and cloud based server, and storage solutions, as well as life-cycle services for hybrid cloud infrastructure deployment. The Financing segment offers client and commercial financing, facilitates IBM clients' acquisition of hardware, software, and services. The company has a strategic partnership to various companies including hyperscalers, service providers, global system integrators, and software and hardware vendors that includes Adobe, Amazon Web services, Microsoft, Oracle, Salesforce, Samsung Electronics and SAP, and others. The company was formerly known as Computing-Tabulating-Recording Co. International Business Machines Corporation was incorporated in 1911 and is headquartered in Armonk, New York.",282200,"{'maxAge': 1, 'name': 'Mr. Arvind  Krishna', 'age': 60, 'title': 'CEO & Chairman of the Board', 'yearBorn': 1963, 'fiscalYear': 2022, 'totalPay': 5618738, 'exercisedValue': 0, 'unexercisedValue': 0}",6,7,5,4,6,1709251200,1672444800,86400,2,188.2,187.76,187.6,193.64,188.2,187.76,187.6,193.64,6.64,0.0353,1707350400,0.8135,4.86,0.708,23.68956,18.12863,4998597,4998597,4995935,4428410,4428410,192.86,192.88,1000,1100,176995876864,120.55,196.9,2.861233,175.2322,150.78384,6.63,0.035228483,USD,219105378304,0.12127,913224548,916745024,21614639,24913613,1705017600,1707955200,0.023599999,0.00097000005,0.60657,3.42,0.023599999,916745024,24.626,7.840084,1703980800,1735603200,1703980800,0.213,7513999872,8.15,10.65,6.52,1046:1000,1635984000,3.542,15.332,0.44557953,0.2689098,1.66,1707350400,NYQ,EQUITY,IBM,IBM,International Business Machines,International Business Machines Corporation,-252322200,America/New_York,EST,cbf44511-d041-3c6d-9dd7-3cc0c033122c,finmb_112350,-18000000,193.0699,215.0,125.0,182.16,188.0,2.6,hold,16,13441000448,14.662,14291000320,59934998528,0.817,0.964,61859999744,265.047,67.888,0.047119997,0.33668998,10817999872,13930999808,0.2,0.041,0.55448,0.23101999,0.2317,USD,4.3449,,,
265,JNJ,One Johnson & Johnson Plaza,New Brunswick,NJ,08933,United States,732 524 0400,https://www.jnj.com,Drug Manufacturers - General,drug-manufacturers-general,Drug Manufacturers - General,Healthcare,healthcare,Healthcare,"Johnson & Johnson, together with its subsidiaries, researches, develops, manufactures, and sells various products in the healthcare field worldwide. The company's Innovative Medicine segment offers products for various therapeutic areas, such as immunology, including rheumatoid arthritis, psoriatic arthritis, inflammatory bowel disease, and psoriasis; infectious diseases comprising HIV/AIDS; neuroscience, consisting of mood disorders, neurodegenerative disorders, and schizophrenia; oncology, such as prostate cancer, hematologic malignancies, lung cancer, and bladder cancer; cardiovascular and metabolism, including thrombosis, diabetes, and macular degeneration; and pulmonary hypertension comprising pulmonary arterial hypertension through retailers, wholesalers, distributors, hospitals, and healthcare professionals for prescription use. Its MedTech segment provides Interventional Solutions, including electrophysiology products to treat heart rhythm disorders; the heart recovery portfolio, which includes technologies to treat severe coronary artery disease requiring high-risk PCI or AMI cardiogenic shock; and neurovascular care that treats hemorrhagic and ischemic stroke. this segment also offers an orthopaedics portfolio that includes products and enabling technologies that support hips, knees, trauma, spine, sports, and other; surgery portfolios comprising advanced and general surgery technologies, as well as solutions for breast aesthetics, ear, nose, and throat procedures; contact lenses under the ACUVUE Brand; and TECNIS intraocular lenses for cataract surgery. It distributes its products to wholesalers, hospitals, and retailers, as well as physicians, nurses, hospitals, eye care professionals, and clinics. Johnson & Johnson was founded in 1886 and is based in New Brunswick, New Jersey.",,"{'maxAge': 1, 'name': 'Mr. Joaquin  Duato', 'age': 60, 'title': 'CEO & Chairman', 'yearBorn': 1963, 'fiscalYear': 2022, 'totalPay': 4839699, 'exercisedValue': 8650825, 'unexercisedValue': 63282216}",6,4,3,2,2,1709251200,1672444800,86400,2,162.12,161.32,158.27,161.61,162.12,161.32,158.27,161.61,4.76,0.0294,1708041600,0.90379995,2.66,0.531,30.609615,14.417572,4460218,4460218,7156856,7243890,7243890,158.9,158.96,1000,800,383403917312,144.95,175.97,4.5022125,158.9686,159.3911,4.7,0.02899087,USD,398014349312,0.41279,2399806614,2408770048,10964520,15005887,1705017600,1707955200,0.0046,0.00093000004,0.71305,1.46,0.0046,2408770048,28.572,5.5708385,1703980800,1735603200,1703980800,0.15,13326000128,5.2,11.04,3.21,2:1,992390400,4.674,12.936,0.042170167,0.2689098,1.19,1708041600,NYQ,EQUITY,JNJ,JNJ,Johnson & Johnson,Johnson & Johnson,-252322200,America/New_York,EST,73aa25b0-87c8-3616-a460-03cbef1b4753,finmb_139677,-18000000,159.17,215.0,157.0,175.05,172.0,2.3,buy,21,22926999552,9.518,30766999552,30432000000,0.817,1.156,85159002112,44.249,33.613,0.08334,0.18308,19789500416,22791000064,0.106,0.073,0.69181997,0.36129,0.22108,USD,0.994,,,
