216,GPC,2999 Wildwood Parkway,Atlanta,GA,30339,United States,678-934-5000,https://www.genpt.com,Specialty Retail,specialty-retail,Specialty Retail,Consumer Cyclical,consumer-cyclical,Consumer Cyclical,"Genuine Parts Company distributes automotive replacement parts, and industrial parts and materials. It operates in two segments: Automotive Parts Group and Industrial Parts Group segments. The company distributes automotive replacement parts for hybrid and electric vehicles, trucks, SUVs, buses, motorcycles, recreational vehicles, farm vehicles, small engines, farm equipment, marine equipment, and heavy duty equipment; and equipment and parts used by repair shops, service stations, fleet operators, automobile and truck dealers, leasing companies, bus and truck lines, mass merchandisers, farms, and individuals. It also distributes industrial replacement parts and related supplies, such as abrasives, adhesives, sealants and tape, bearings, chemicals, cutting tools, electrical, facility maintenance, hose and fittings, hydraulics, janitorial, mechanical power transmission, pneumatics, process pumps and equipment, safety, seals and gaskets, and tools and testing instruments, as well as maintenance, repair, and operation customers in aggregate and cement, automotive, chemical and allied products, equipment and machinery, equipment rental and leasing, fabricated metals, food and beverage, iron and steel, lumber and wood, oil and gas, pulp and paper, and rubber products. In addition, the company provides various services and repairs comprising gearbox and fluid power and process pump assembly and repair, hydraulic drive shaft repair, electrical panel assembly and repair, hose and gasket manufacture and assembly. It operates in the United States, Canada, France, the United Kingdom, Ireland, Germany, Poland, the Netherlands, Belgium, Spain, Portugal, Australia, New Zealand, Mexico, Indonesia, and Singapore. The company was incorporated in 1928 and is headquartered in Atlanta, Georgia.",60000,"{'maxAge': 1, 'name': 'Mr. Paul D. Donahue', 'age': 66, 'title': 'Chairman & CEO', 'yearBorn': 1957, 'fiscalYear': 2023, 'totalPay': 3227392, 'exercisedValue': 0, 'unexercisedValue': 765129}",3,8,6,6,5,1709251200,1703980800,86400,2,149.94,150.7,149.975,151.39,149.94,150.7,149.975,151.39,4.0,0.026700001,1709164800,0.4073,2.76,0.945,16.10192,14.172726,268606,268606,1007360,1203340,1203340,150.33,150.46,1000,800,20945643520,126.35,174.91,0.9071065,142.2626,147.40945,3.8,0.02534347,USD,25003620352,0.05702,138855700,139423008,1543786,1467154,1705017600,1707955200,0.0111,0.00275,0.80246,1.53,0.0127,139423008,31.534,4.7640924,1703980800,1735603200,1703980800,0.258,1316524032,9.33,10.6,2.15,3:2,861062400,1.083,11.64,-0.111308694,0.27220368,1.0,1709164800,NYQ,EQUITY,GPC,GPC,Genuine Parts Company,Genuine Parts Company,322151400,America/New_York,EST,2e50ae82-e546-35a3-bd5e-f0da6b120ddd,finmb_275034,-18000000,150.2309,187.0,140.0,156.0,155.0,2.4,buy,9,1102007040,7.904,2148023040,5184581120,0.425,1.227,23090610176,117.378,164.502,0.06519,0.32027,663679616,1435609984,0.263,0.011,0.35904998,0.093030006,0.07721,USD,3.1193,,,
217,GILD,333 Lakeside Drive,Foster City,CA,94404,United States,650 574 3000,https://www.gilead.com,Drug Manufacturers - General,drug-manufacturers-general,Drug Manufacturers - General,Healthcare,healthcare,Healthcare,"Gilead Sciences, Inc., a biopharmaceutical company, discovers, develops, and commercializes medicines in the areas of unmet medical need in the United States, Europe, and internationally. The company provides Biktarvy, Genvoya, Descovy, Odefsey, Truvada, Complera/ Eviplera, Stribild, Sunlencs, and Atripla products for the treatment of HIV/AIDS; Veklury, an injection for intravenous use, for the treatment of COVID-19; and Epclusa, Harvoni, Vemlidy, and Viread for the treatment of viral hepatitis. It also offers Yescarta, Tecartus, and Trodelvy products for the treatment of oncology; Letairis, an oral formulation for the treatment of pulmonary arterial hypertension; and AmBisome, a liposomal formulation for the treatment of serious invasive fungal infections. Gilead Sciences, Inc. has collaboration agreements with Arcus Biosciences, Inc.; Merck Sharp & Dohme Corp.; Pionyr Immunotherapeutics Inc.; Tizona Therapeutics, Inc.; Galapagos NV; Janssen Sciences Ireland Unlimited Company; Japan Tobacco, Inc.; Dragonfly Therapeutics, Inc.; Arcellx, Inc.; Everest Medicines; Merck & Co, Inc.; Tentarix Biotherapeutics Inc.; and Assembly Biosciences, Inc. The company was incorporated in 1987 and is headquartered in Foster City, California.",18000,"{'maxAge': 1, 'name': ""Mr. Daniel P.  O'Day"", 'age': 59, 'title': 'Chairman & CEO', 'yearBorn': 1964, 'fiscalYear': 2022, 'totalPay': 7267338, 'exercisedValue': 0, 'unexercisedValue': 9635551}",3,5,3,1,1,1709251200,1672444800,86400,2,72.99,72.88,72.568,73.3199,72.99,72.88,72.568,73.3199,3.08,0.0422,1710374400,0.6667,3.97,0.2,16.162777,10.633406,2178036,2178036,7337616,6065640,6065640,72.84,72.84,800,800,90607960064,71.37,87.87,3.3414943,78.3698,77.56235,3.0,0.041101523,USD,108153085952,0.20892,1239458539,1245769984,19880222,17135011,1705017600,1707955200,0.016,0.00099,0.88509005,2.45,0.0178,1245769984,18.325,3.969031,1703980800,1735603200,1703980800,-0.129,5664999936,4.5,6.84,2.36,2:1,1359331200,3.989,8.992,-0.089900255,0.27220368,0.75,1702512000,NMS,EQUITY,GILD,GILD,"Gilead Sciences, Inc.","Gilead Sciences, Inc.",696090600,America/New_York,EST,8659e669-8ec5-3b0f-9929-db5db506231f,finmb_29002,-18000000,72.7325,111.47,63.56,79.22,75.08,2.5,buy,24,8350000128,6.703,12028000256,25657999360,1.153,1.426,27115999232,112.787,21.728,0.09313,0.25538,8501374976,8006000128,-0.131,-0.037,0.77972,0.44358003,0.35648,USD,0.4156,,650 578 9264,
220,GS,200 West Street,New York,NY,10282,United States,212 902 1000,https://www.goldmansachs.com,Capital Markets,capital-markets,Capital Markets,Financial Services,financial-services,Financial Services,"The Goldman Sachs Group, Inc., a financial institution, provides a range of financial services for corporations, financial institutions, governments, and individuals worldwide. It operates through Global Banking & Markets, Asset & Wealth Management, and Platform Solutions segments. The Global Banking & Markets segment provides financial advisory services, including strategic advisory assignments related to mergers and acquisitions, divestitures, corporate defense activities, restructurings, and spin-offs; and relationship lending, and acquisition financing, as well as secured lending, through structured credit and asset-backed lending and involved in financing under securities to resale agreements. This segment also offers client execution activities for cash and derivative instruments; credit and interest rate products; and provision of mortgages, currencies, commodities, and equities related products, as well as underwriting services. The Asset & Wealth Management segment manages assets across various classes, including equity, fixed income, hedge funds, credit funds, private equity, real estate, currencies, and commodities; and provides customized investment advisory solutions, wealth advisory services, personalized financial planning, and private banking services, as well as invests in corporate equity, credit, real estate, and infrastructure assets. The Platform Solutions segment offers credit cards and point-of-sale financing for purchase of goods or services. This segment also provides cash management services, such as deposit-taking and payment solutions for corporate and institutional clients. The Goldman Sachs Group, Inc. was founded in 1869 and is headquartered in New York, New York.",45300,"{'maxAge': 1, 'name': 'Mr. David  Solomon', 'age': 61, 'title': 'Chairman & CEO', 'yearBorn': 1962, 'fiscalYear': 2022, 'totalPay': 9205077, 'exercisedValue': 0, 'unexercisedValue': 0}",5,7,6,6,7,1709251200,1672444800,86400,2,390.91,395.0,384.52,395.15,390.91,395.0,384.52,395.15,11.0,0.028099999,1709078400,0.4591,2.22,1.416,17.079361,10.01038,1090794,1090794,2289255,2193160,2193160,390.44,390.67,1800,1400,127166545920,289.36,397.49,2.8118017,384.5926,344.05264,10.5,0.026860403,USD,-185768050688,0.1883,340821915,325563008,3974914,4356525,1705017600,1707955200,0.012200001,0.0051700003,0.7253,1.58,0.0123000005,326112000,310.247,1.2590129,1703980800,1735603200,1703980800,0.514,7856000000,22.87,39.02,1.17,,,-4.108,,0.119156,0.27220368,2.75,1709078400,NYQ,EQUITY,GS,GS,"Goldman Sachs Group, Inc. (The)","The Goldman Sachs Group, Inc.",925824600,America/New_York,EST,71a75a16-7c33-358b-bb56-1764255c880a,finmb_398625,-18000000,390.605,506.0,355.0,418.49,419.0,2.3,buy,21,1031744978944,3008.972,,700372025344,1.429,1.546,45226000384,597.241,132.705,0.0055199997,0.07244,,-12586999808,0.649,0.116,0.83158,,0.11572,USD,3.0936,,,
227,HSY,19 East Chocolate Avenue,Hershey,PA,17033,United States,717 534 4200,https://www.thehersheycompany.com,Confectioners,confectioners,Confectioners,Consumer Defensive,consumer-defensive,Consumer Defensive,"The Hershey Company, together with its subsidiaries, engages in the manufacture and sale of confectionery products and pantry items in the United States and internationally. The company operates through three segments: North America Confectionery, North America Salty Snacks, and International. It offers chocolate and non-chocolate confectionery products; gum and mint refreshment products, including mints, chewing gums, and bubble gums; protein bars; pantry items, such as baking ingredients, toppings, beverages, and sundae syrups; and snack items comprising spreads, bars, snack bites, mixes, popcorn, and pretzels. The company provides its products primarily under the Hershey's, Reese's, Kisses, Jolly Rancher, Almond Joy, Brookside, barkTHINS, Cadbury, Good & Plenty, Heath, Kit Kat, Payday, Rolo, Twizzlers, Whoppers, York, Ice Breakers, Breath Savers, Bubble Yum, Lily's, SkinnyPop, Pirates Booty, Dot's Homestyle Pretzels, and ONE Bar brands, as well as under the Pelon Pelo Rico, IO-IO, and Sofit brands. It markets and sells its products to wholesale distributors, chain grocery stores, mass merchandisers, chain drug stores, vending companies, wholesale clubs, convenience stores, dollar stores, concessionaires, and department stores. The company exports its products in approximately 80 countries worldwide. The Hershey Company was founded in 1894 and is headquartered in Hershey, Pennsylvania.",18650,"{'maxAge': 1, 'name': 'Ms. Michele Gross Buck', 'age': 61, 'title': 'Chairman, President & CEO', 'yearBorn': 1962, 'fiscalYear': 2022, 'totalPay': 5850728, 'exercisedValue': 2039986, 'unexercisedValue': 34000784}",4,9,6,10,10,1709251200,1672444800,86400,2,187.56,194.82,191.05,196.84,187.56,194.82,191.05,196.84,5.48,0.0292,1708041600,0.4918,1.96,0.339,21.281456,18.884426,1565830,1565830,1743395,1792000,1792000,193.41,193.54,800,1000,39323598848,178.82,276.88,3.5220447,190.8458,211.1724,4.456,0.02375773,USD,42976563200,0.16675,146366725,149336000,2582478,2543892,1705017600,1707955200,0.0126,0.0031299999,0.80859,1.36,0.019199999,203950000,20.055,9.614061,1703980800,1735603200,1703980800,-0.119,1861787008,9.06,10.21,3.35,2:1,1087344000,3.849,14.558,-0.21516442,0.27220368,1.37,1708041600,NYQ,EQUITY,HSY,HSY,The Hershey Company,The Hershey Company,322151400,America/New_York,EST,40d8e0c9-bf7f-3432-8f37-196ba1a93230,finmb_98873,-18000000,192.81,238.0,183.0,212.57,210.0,2.7,hold,21,401902016,1.971,2952032000,5125612032,0.407,0.968,11164991488,125.043,54.533,0.13851,0.50328,1028696256,2323190016,-0.115,0.002,0.44768003,0.2644,0.16936001,USD,3.1717,,717 534 7464,
229,HPE,1701 East Mossy Oaks Road,Spring,TX,77389,United States,678 259 9860,https://www.hpe.com,Communication Equipment,communication-equipment,Communication Equipment,Technology,technology,Technology,"Hewlett Packard Enterprise Company provides solutions that allow customers to capture, analyze, and act upon data seamlessly in the Americas, Europe, the Middle East, Africa, the Asia Pacific, and Japan. It operates in six segments: Compute, HPC & AI, Storage, Intelligent Edge, Financial Services, and Corporate Investments and Other. The company offers general purpose servers for multi-workload computing and workload-optimized servers; HPE ProLiant rack and tower servers; HPE Synergy; HPE Alletra, HPE GreenLake, Zerto, HPE InfoSight, and HPE CloudPhysics storage products; HPE Cray EX, HPE Cray XD, and converged edge systems; and HPE Superdome Flex, HPE Nonstop, and HPE Integrity products. It also provides HPE Aruba products that includes hardware products, such as Wi-Fi access points, switches, and gateways; HPE Aruba Networking software and services comprising cloud-based management, network management and access control, analytics and assurance, software-defined wide-area networking, network security, analytics and assurance, and location services software; and professional and support services, as well as as-a-service and consumption models. In addition, the company offers leasing, financing, IT consumption, and utility programs and asset management services for customers to facilitate technology deployment models and the acquisition of various IT solutions, including hardware, software, and services from Hewlett Packard Enterprise and others; consultative-led services; HPE Ezmeral Container Platform; HPE Ezmeral Software Container Platform and HPE Ezmeral Software Data Fabric; OpsRamp; and Hewlett Packard Labs. It serves commercial and large enterprise groups, such as business and public sector enterprises; and through various partners comprising resellers, distribution partners, original equipment manufacturers, independent software vendors, systems integrators, and advisory firms. The company was founded in 1939 and is headquartered in Spring, Texas.",62000,"{'maxAge': 1, 'name': 'Mr. Antonio Fabio Neri', 'age': 56, 'title': 'CEO, President & Director', 'yearBorn': 1967, 'fiscalYear': 2023, 'totalPay': 4488746, 'exercisedValue': 0, 'unexercisedValue': 0}",5,1,5,5,2,1709251200,1703980800,86400,2,18.1,18.35,18.34,20.07,18.1,18.35,18.34,20.07,0.52,0.0287,1710374400,0.3379,3.41,1.201,13.279309,9.347087,33156860,33156860,12999348,20814700,20814700,19.13,19.14,1800,3100,25031499776,13.655,20.07,0.89140344,15.8816,16.3772,0.49,0.027071822,USD,32621000704,0.06805,1292785000,1299830016,30623487,28499277,1705017600,1707955200,0.023599999,0.00592,0.83505994,3.06,0.0269,1300000000,16.474,1.1688113,1698710400,1730332800,1706659200,-0.228,1911000064,1.45,2.06,3.55,1289:1000,1504224000,1.162,6.557,0.19867551,0.27220368,0.13,1702339200,NYQ,EQUITY,HPE,HPE,Hewlett Packard Enterprise Comp,Hewlett Packard Enterprise Company,1445261400,America/New_York,EST,3cd9b23e-d311-30b2-abcb-cc8c9a1dc8c0,finmb_273983758,-18000000,19.255,20.0,14.0,16.96,17.0,2.7,hold,13,3758000128,2.891,4975000064,12796999680,0.493,0.894,28081000448,59.61,21.605,0.025810001,0.09203,1917250048,5320999936,-0.237,-0.135,0.35658002,0.17717,0.08335,USD,2.1434,,,
265,JNJ,One Johnson & Johnson Plaza,New Brunswick,NJ,08933,United States,732 524 0400,https://www.jnj.com,Drug Manufacturers - General,drug-manufacturers-general,Drug Manufacturers - General,Healthcare,healthcare,Healthcare,"Johnson & Johnson, together with its subsidiaries, researches, develops, manufactures, and sells various products in the healthcare field worldwide. The company's Innovative Medicine segment offers products for various therapeutic areas, such as immunology, including rheumatoid arthritis, psoriatic arthritis, inflammatory bowel disease, and psoriasis; infectious diseases comprising HIV/AIDS; neuroscience, consisting of mood disorders, neurodegenerative disorders, and schizophrenia; oncology, such as prostate cancer, hematologic malignancies, lung cancer, and bladder cancer; cardiovascular and metabolism, including thrombosis, diabetes, and macular degeneration; and pulmonary hypertension comprising pulmonary arterial hypertension through retailers, wholesalers, distributors, hospitals, and healthcare professionals for prescription use. Its MedTech segment provides Interventional Solutions, including electrophysiology products to treat heart rhythm disorders; the heart recovery portfolio, which includes technologies to treat severe coronary artery disease requiring high-risk PCI or AMI cardiogenic shock; and neurovascular care that treats hemorrhagic and ischemic stroke. this segment also offers an orthopaedics portfolio that includes products and enabling technologies that support hips, knees, trauma, spine, sports, and other; surgery portfolios comprising advanced and general surgery technologies, as well as solutions for breast aesthetics, ear, nose, and throat procedures; contact lenses under the ACUVUE Brand; and TECNIS intraocular lenses for cataract surgery. It distributes its products to wholesalers, hospitals, and retailers, as well as physicians, nurses, hospitals, eye care professionals, and clinics. Johnson & Johnson was founded in 1886 and is based in New Brunswick, New Jersey.",,"{'maxAge': 1, 'name': 'Mr. Joaquin  Duato', 'age': 60, 'title': 'CEO & Chairman', 'yearBorn': 1963, 'fiscalYear': 2022, 'totalPay': 4839699, 'exercisedValue': 8650825, 'unexercisedValue': 63282216}",6,4,3,2,2,1709251200,1672444800,86400,2,159.97,160.62,159.28,160.93,159.97,160.62,159.28,160.93,4.76,0.0298,1708041600,0.90379995,2.66,0.531,30.819231,15.758111,2486507,2486507,7205511,7122690,7122690,160.24,160.3,800,800,386029486080,144.95,175.97,4.533044,159.1702,159.3985,4.7,0.029380508,USD,392835497984,0.41279,2399830702,2408770048,10964520,15005887,1705017600,1707955200,0.0046,0.00093000004,0.71282,1.46,0.0046,2408770048,28.572,5.6089873,1703980800,1735603200,1703980800,0.15,13326000128,5.2,10.17,3.76,2:1,992390400,4.613,12.768,0.04582894,0.27220368,1.19,1708041600,NYQ,EQUITY,JNJ,JNJ,Johnson & Johnson,Johnson & Johnson,-252322200,America/New_York,EST,73aa25b0-87c8-3616-a460-03cbef1b4753,finmb_139677,-18000000,160.26,198.06,144.63,161.26,158.45,2.3,buy,21,22926999552,9.518,30766999552,30432000000,0.817,1.156,85159002112,44.249,33.613,0.08334,0.18308,19789500416,22791000064,0.106,0.073,0.69181997,0.36129,0.22108,USD,0.9808,,,
270,KVUE,199 Grandview Road,Skillman,NJ,08558,United States,908-874-1200,https://www.kenvue.com,Household & Personal Products,household-personal-products,Household & Personal Products,Consumer Defensive,consumer-defensive,Consumer Defensive,"Kenvue Inc. operates as a consumer health company worldwide. The company operates through three segments: Self Care, Skin Health and Beauty, and Essential Health. The Self Care segment offers cough, cold and allergy, pain care, digestive health, smoking cessation, eye care, and other products under the Tylenol, Motrin, Benadryl, Nicorette, Zarbee's, ORSLTM, Rhinocort, Calpol, and Zyrtec brands. The Skin Health and Beauty segment provides face and body care, hair, sun, and other care products under the Neutrogena, Aveeno, Dr.Ci:Labo, Le Petit Marseillais, Lubriderm, Rogaine, and OGX brand names. The Essential Health segment offers oral and baby, women's health, wound, and other care products under the Listerine, Johnson's, Band-Aid, and Stayfree, o.b., tampons, Carefree, and Desitin Diaper Rash brands. The company was incorporated in 2022 and is headquartered in Skillman, New Jersey.",22000,"{'maxAge': 1, 'name': 'Mr. Thibaut  Mongon', 'age': 52, 'title': 'CEO & Director', 'yearBorn': 1971, 'fiscalYear': 2022, 'totalPay': 1912208, 'exercisedValue': 4830204, 'unexercisedValue': 0}",,,,,,,1672444800,86400,2,19.01,19.0,18.99,19.64,19.01,19.0,18.99,19.64,0.8,0.0421,1707782400,0.44439998,,,21.822222,15.712,7394970,7394970,18291583,15892440,15892440,19.53,19.53,3000,3000,37602349056,17.82,27.795,2.4347546,20.3926,21.9305,0.4,0.021041557,USD,43441201152,0.10774,1728829120,1914579968,22342489,29369819,1705017600,1707955200,0.0117,0.00017999999,0.98793,1.37,0.1121,1914579968,5.854,3.3549707,1703980800,1735603200,1703980800,-0.094,1664000000,0.9,1.25,9.23,,,2.813,12.168,-0.29330856,0.27220368,0.2,1707782400,NYQ,EQUITY,KVUE,KVUE,Kenvue Inc.,Kenvue Inc.,1683207000,America/New_York,EST,6483d7dc-a3c6-3526-8df5-90efb8bf74b4,finmb_1820759186,-18000000,19.64,25.0,20.0,22.36,22.0,2.4,buy,11,1382000000,0.722,3569999872,8426999808,0.63,1.12,15443999744,75.167,8.366,0.06668,0.10656,2798625024,3168000000,-0.187,-0.027,0.55963004,0.23115999,0.16121,USD,2.0709,,,
271,KDP,53 South Avenue,Burlington,MA,01803,United States,781 418 7000,https://www.keurigdrpepper.com,Beverages - Non-Alcoholic,beverages-non-alcoholic,Beverages - Non - Alcoholic,Consumer Defensive,consumer-defensive,Consumer Defensive,"Keurig Dr Pepper Inc. owns, manufactures, and distributors beverages and single serve brewing systems in the United States and internationally. It operates through three segments: U.S. Refreshment Beverages, U.S. Coffee, and International. The U.S. Refreshment Beverages segment manufactures and distributes branded concentrates, syrup, and finished beverages. Its U.S. Coffee segment offers finished goods relating to K-Cup pods, single serve brewers, specialty coffee, and ready to drink coffee products through Keurig.com website. The International segment provides sales in Canada, Mexico, the Caribbean, and other international markets from the manufacture and distribution of branded concentrates, syrup, and finished beverages; and sales in Canada from the manufacture and distribution of finished goods relating to the Company's single serve brewers, KCup pods, and other coffee products. It serves retailers, third-party bottlers and distributors, retail partners, hotel chains, office coffee distributors, and end-use consumers. The company offers its products under the Dr Pepper, Canada Dry, Green Mountain Coffee Roasters, Snapple, Mott's, The Original Donut Shop, Clamato, and Core Hydration brand name. Keurig Dr Pepper Inc. was founded in 1981 and is headquartered in Burlington, Massachusetts.",28100,"{'maxAge': 1, 'name': 'Mr. Robert J. Gamgort', 'age': 61, 'title': 'CEO, President & Chairman', 'yearBorn': 1962, 'fiscalYear': 2022, 'totalPay': 3304211, 'exercisedValue': 0, 'unexercisedValue': 0}",8,10,9,9,10,1709251200,1672444800,86400,2,29.09,29.24,29.18,29.4,29.09,29.24,29.18,29.4,0.86,0.0296,1711497600,0.5355,2.14,0.661,18.906452,14.295122,3216299,3216299,9522588,18131220,18131220,29.25,29.26,1200,1000,40663326720,27.66,35.99,2.7449255,31.4648,31.8045,0.83,0.028532142,USD,55188021248,0.14723,966887292,1387590016,16115508,11445309,1705017600,1707955200,0.0116,0.32025,0.67885,2.15,0.0172,1387590016,18.466,1.5869707,1703980800,1735603200,1703980800,0.53,2180999936,1.55,2.05,2.19,,,3.725,14.004,-0.16359979,0.27220368,0.215,1704326400,NMS,EQUITY,KDP,KDP,Keurig Dr Pepper Inc.,Keurig Dr Pepper Inc.,1210167000,America/New_York,EST,385f021e-f690-3f2a-8d31-1901fcfc08f9,finmb_334622,-18000000,29.305,41.0,27.0,35.28,35.0,2.3,buy,18,267000000,0.192,3940999936,15089999872,0.2,0.379,14814000128,58.771,10.587,0.03873,0.08586001,661124992,1328999936,0.554,0.017,0.54543,0.26603,0.24308,USD,1.0071,,,
274,KMB,PO Box 619100,Dallas,TX,75261-9100,United States,972 281 1200,https://www.kimberly-clark.com,Household & Personal Products,household-personal-products,Household & Personal Products,Consumer Defensive,consumer-defensive,Consumer Defensive,"Kimberly-Clark Corporation, together with its subsidiaries, manufactures and markets personal care and consumer tissue products in the United States. It operates through three segments: Personal Care, Consumer Tissue, and K-C Professional. The company's Personal Care segment offers disposable diapers, training and youth pants, swimpants, baby wipes, feminine and incontinence care products, reusable underwear, and other related products under the Huggies, Pull-Ups, Little Swimmers, GoodNites, DryNites, Sweety, Kotex, U by Kotex, Intimus, Thinx, Poise, Depend, Plenitud, Softex, and other brand names. Its Consumer Tissue segment provides facial and bathroom tissues, paper towels, napkins, and related products under the Kleenex, Scott, Cottonelle, Viva, Andrex, Scottex, Neve, and other brand names. The company's K-C Professional segment offers wipers, tissues, towels, apparel, personal protective equipment, soaps, and sanitizers under the Kleenex, Scott, WypAll, Kimtech, and KleenGuard brands. It also sells household use products directly to supermarkets, mass merchandisers, drugstores, warehouse clubs, variety and department stores, and other retail outlets, as well as through other distributors and e-commerce; and away-from-home use products directly to distributors, manufacturing, lodging, office building, food service, and public facilities, as well as through e-commerce. Kimberly-Clark Corporation was founded in 1872 and is headquartered in Dallas, Texas.",41000,"{'maxAge': 1, 'name': 'Mr. Michael D. Hsu', 'age': 59, 'title': 'Chairman & CEO', 'yearBorn': 1964, 'fiscalYear': 2022, 'totalPay': 3912840, 'exercisedValue': 1716094, 'unexercisedValue': 7856650}",1,6,8,4,4,1709251200,1672444800,86400,2,123.62,123.57,123.252,124.92,123.62,123.57,123.252,124.92,4.88,0.0395,1709769600,0.90599996,3.33,0.412,23.942598,16.985199,821666,821666,1973988,1954370,1954370,124.52,124.54,1100,1300,41942441984,116.32,147.87,2.0528824,121.4572,126.05635,4.72,0.03818152,USD,49191501824,0.086339995,335545772,336883008,4691690,4255925,1705017600,1707955200,0.0139,0.00318,0.78806996,2.09,0.0139,336883008,2.715,45.856907,1703980800,1735603200,1703980800,0.004,1764000000,5.2,7.33,3.55,1043:1000,1414972800,2.408,13.593,-0.0014539361,0.27220368,1.18,1701907200,NYQ,EQUITY,KMB,KMB,Kimberly-Clark Corporation,Kimberly-Clark Corporation,322151400,America/New_York,EST,319f9bda-f839-37ec-9524-26fad07b17fb,finmb_283857,-18000000,124.5015,153.0,110.0,128.38,126.5,3.1,hold,16,1092999936,3.244,3619000064,8486000128,0.466,0.823,20430999552,794.569,60.483,0.10145,1.9954801,2326125056,3542000128,0.007,0.001,0.34418,0.17713,0.117910005,USD,1.567,,,
