127,GLW,One Riverfront Plaza,Corning,NY,14831,United States,607-974-9000,https://www.corning.com,Electronic Components,electronic-components,Electronic Components,Technology,technology,Technology,"Corning Incorporated engages in the display technologies, optical communications, environmental technologies, specialty materials, and life sciences businesses in the United States and internationally. The company's Display Technologies segment offers glass substrates for flat panel displays, including liquid crystal displays and organic light-emitting diodes that are used in televisions, notebook computers, desktop monitors, tablets, and handheld devices. Its Optical Communications segment provides optical fibers and cables; and hardware and equipment products, such as cable assemblies, fiber optic hardware and connectors, optical components and couplers, closures, network interface devices, and other accessories for the telecommunications industry, businesses, governments, and individuals. The company's Specialty Materials segment manufactures products that offer material formulations for glass, glass ceramics, crystals, precision metrology instruments, and software, as well as glass wafers and substrates, tinted sunglasses, and radiation shielding products for various markets comprising mobile consumer electronics, semiconductor equipment optics and consumables, aerospace and defense optics, radiation shielding products, sunglasses, and telecommunications components. Its Environmental Technologies segment provides ceramic substrates and filter products for emissions control in mobile, gasoline, and diesel applications. The company's Life Sciences segment offers laboratory products, including consumables, such as plastic vessels, liquid handling plastics, specialty surfaces, cell culture media, and serum, as well as general labware, and glassware and equipment under the Corning, Pyrex, Falcon, and Axygen brands. The company was formerly known as Corning Glass Works and changed its name to Corning Incorporated in April 1989. Corning Incorporated was founded in 1851 and is headquartered in Corning, New York.",49800,"{'maxAge': 1, 'name': 'Mr. Wendell P. Weeks', 'age': 63, 'title': 'Chairman & CEO', 'yearBorn': 1960, 'fiscalYear': 2022, 'totalPay': 5508245, 'exercisedValue': 3530831, 'unexercisedValue': 2843958}",7,6,9,6,8,1709251200,1672444800,86400,2,32.5,32.72,32.655,33.16,32.5,32.72,32.655,33.16,1.12,0.0345,1709078400,1.6471001,2.91,1.074,48.676468,15.324073,1178238,1178238,4798303,4484680,4484680,33.1,33.12,900,1300,28249987072,25.26,36.02,2.2441998,31.3822,31.1513,1.12,0.03446154,USD,34759913472,0.04616,766641840,853473984,10718269,10240276,1705017600,1707955200,0.0126,0.09681,0.71166,2.02,0.0126,853473984,14.087,2.349684,1703980800,1735603200,1703980800,,581000000,0.68,2.16,2.44,3:1,970617600,2.761,12.908,-0.05468297,0.27220368,0.28,1709078400,NYQ,EQUITY,GLW,GLW,Corning Incorporated,Corning Incorporated,378657000,America/New_York,EST,00ec92fb-b808-359d-ab84-18e395eb0a3b,finmb_173840,-18000000,33.1,40.0,29.0,34.7,35.0,2.3,buy,10,1779000064,2.084,2692999936,8483999744,0.776,1.67,12588000256,71.486,14.844,0.02853,0.05368,214875008,2004999936,,-0.121,0.33476,0.21393,0.16433,USD,1.1448,,,
135,CVS,One CVS Drive,Woonsocket,RI,02895,United States,401 765 1500,https://www.cvshealth.com,Healthcare Plans,healthcare-plans,Healthcare Plans,Healthcare,healthcare,Healthcare,"CVS Health Corporation provides health solutions in the United States. It operates through Health Care Benefits, Health Services, and Pharmacy & Consumer Wellness segments. The Health Care Benefits segment offers traditional, voluntary, and consumer-directed health insurance products and related services. It serves employer groups, individuals, college students, part-time and hourly workers, health plans, health care providers, governmental units, government-sponsored plans, labor groups, and expatriates. The Health Services segment offers pharmacy benefit management solutions, including plan design and administration, formulary management, retail pharmacy network management, mail order pharmacy, specialty pharmacy and infusion, clinical, and disease and medical spend management services. It serves employers, insurance companies, unions, government employee groups, health plans, prescription drug plans, Medicaid managed care plans, CMS, plans offered on public health insurance and private health insurance exchanges, other sponsors of health benefit plans, and individuals. The Pharmacy & Consumer Wellness segment sells prescription and over-the-counter drugs, consumer health and beauty products, and personal care products. This segment also distributes prescription drugs; and provides related pharmacy consulting and other ancillary services to care facilities and other care settings. It operates online retail pharmacy websites, LTC pharmacies and on-site pharmacies, retail specialty pharmacy stores, compounding pharmacies and branches for infusion and enteral nutrition services. The company was formerly known as CVS Caremark Corporation and changed its name to CVS Health Corporation in September 2014. CVS Health Corporation was incorporated in 1996 and is headquartered in Woonsocket, Rhode Island.",219000,"{'maxAge': 1, 'name': 'Ms. Karen Sue Lynch', 'age': 60, 'title': 'President, CEO & Director', 'yearBorn': 1963, 'fiscalYear': 2022, 'totalPay': 4817125, 'exercisedValue': 0, 'unexercisedValue': 26139724}",7,4,4,7,5,1709251200,1672444800,86400,2,73.71,73.57,73.42,74.705,73.71,73.57,73.42,74.705,2.66,0.0361,1705622400,0.374,2.87,0.499,11.464452,8.045011,4257938,4257938,11287543,9784540,9784540,74.49,74.53,800,800,93345538048,64.41,83.25,0.26174852,76.4018,71.87765,2.42,0.032831367,USD,160865320960,0.0234,1252333488,1258450048,30761242,42521469,1705017600,1707955200,0.024400001,0.0014599999,0.83072,2.44,0.024500001,1258450048,59.364,1.2494947,1703980800,1735603200,1703980800,-0.123,8344000000,6.47,9.22,2.4,2:1,1118102400,0.451,8.724,-0.07643151,0.27220368,0.665,1705622400,NYQ,EQUITY,CVS,CVS,CVS Health Corporation,CVS Health Corporation,99153000,America/New_York,EST,51332b8f-ec73-31f1-aeb5-259d61fabb3a,finmb_93625,-18000000,74.175,99.0,74.0,88.4,88.0,2.1,buy,23,11454999552,9.102,18439000064,79385001984,0.59,0.857,356622991360,103.587,277.528,0.0368,0.112770006,11075375104,13425999872,-0.105,0.12,0.1494,0.0517,0.03675,USD,1.0687,,401-652-0893,
137,DRI,1000 Darden Center Drive,Orlando,FL,32837,United States,407 245 4000,https://www.darden.com,Restaurants,restaurants,Restaurants,Consumer Cyclical,consumer-cyclical,Consumer Cyclical,"Darden Restaurants, Inc., together with its subsidiaries, owns and operates full-service restaurants in the United States and Canada. It operates under Olive Garden, LongHorn Steakhouse, Cheddar's Scratch Kitchen, Yard House, The Capital Grille, Seasons 52, Bahama Breeze, Eddie V's Prime Seafood, and Capital Burger brand names. Darden Restaurants, Inc. was incorporated in 1995 and is based in Orlando, Florida.",187384,"{'maxAge': 1, 'name': 'Mr. Ricardo  Cardenas', 'age': 55, 'title': 'CEO, President & Director', 'yearBorn': 1968, 'fiscalYear': 2023, 'totalPay': 2937503, 'exercisedValue': 1139146, 'unexercisedValue': 7632155}",7,3,2,1,2,1709251200,1703980800,86400,2,174.41,174.02,173.96,175.84,174.41,174.02,173.96,175.84,5.14,0.0295,1704758400,0.6102,2.74,1.253,21.230955,18.101032,260942,260942,1047716,1139660,1139660,175.53,175.6,900,900,20966182912,133.36,176.84,1.9037495,164.2216,158.2648,5.04,0.028897425,USD,27685939200,0.09155,118567773,119411000,5784739,5326068,1705017600,1707955200,0.0484,0.00361,0.95252,6.22,0.0746,119411000,17.069,10.286484,1685232000,1716854400,1700956800,0.133,1009500032,8.27,9.7,1.97,10000:8939,1447113600,2.514,16.227,0.19680226,0.27220368,1.31,1704758400,NYQ,EQUITY,DRI,DRI,"Darden Restaurants, Inc.","Darden Restaurants, Inc.",800026200,America/New_York,EST,19cb3c7b-5f7b-3bfc-b2af-6a8d397bf76d,finmb_336160,-18000000,175.58,193.0,154.0,178.32,180.0,2.0,buy,25,195700000,1.639,1706200064,7055200256,0.116,0.364,11013099520,345.894,91.13,0.07654,0.49722,760249984,1519000064,0.159,0.097,0.2084,0.15492,0.109560005,USD,2.0876,,,
143,DVN,333 West Sheridan Avenue,Oklahoma City,OK,73102-5015,United States,405 235 3611,https://www.devonenergy.com,Oil & Gas E&P,oil-gas-e-p,Oil & Gas E&P,Energy,energy,Energy,"Devon Energy Corporation, an independent energy company, engages in the exploration, development, and production of oil, natural gas, and natural gas liquids in the United States. It operates in Delaware, Eagle Ford, Anadarko, Williston, and Powder River Basins. The company was founded in 1971 and is headquartered in Oklahoma City, Oklahoma.",1900,"{'maxAge': 1, 'name': 'Mr. Richard E. Muncrief', 'age': 64, 'title': 'President, CEO & Director', 'yearBorn': 1959, 'fiscalYear': 2022, 'totalPay': 4119850, 'exercisedValue': 507800, 'unexercisedValue': 850788}",5,1,2,7,2,1709251200,1672444800,86400,2,45.08,45.57,44.9,45.595,45.08,45.57,44.9,45.595,2.42,0.0537,1710374400,0.4914,4.53,2.2,7.797945,8.295082,3426461,3426461,8889398,8933330,8933330,45.52,45.53,1200,900,28917901312,40.47,56.19,2.0044293,43.42,47.04395,2.87,0.06366459,USD,34392719360,0.25972,627805818,635000000,14825986,14072670,1705017600,1707955200,0.0233,0.00732,0.70788,1.85,0.026800001,635286016,18.973,2.400253,1703980800,1735603200,1703980800,-0.041,3747000064,5.84,5.49,-2.97,2:1,1100563200,2.384,4.595,-0.17284405,0.27220368,0.77,1702512000,NYQ,EQUITY,DVN,DVN,Devon Energy Corporation,Devon Energy Corporation,490887000,America/New_York,EST,d14cc3ae-fc64-3a70-b4ac-a4ab70fd9067,finmb_266510,-18000000,45.54,75.0,46.0,52.84,52.0,2.2,buy,25,853000000,1.344,7484000256,6482999808,0.823,1.071,14426999808,53.065,22.577,0.12707,0.32169,1434499968,6544000000,-0.005,-0.121,0.54675,0.51875,0.41715,USD,,,,
145,FANG,500 West Texas Avenue,Midland,TX,79701,United States,(432) 221-7400,https://www.diamondbackenergy.com,Oil & Gas E&P,oil-gas-e-p,Oil & Gas E&P,Energy,energy,Energy,"Diamondback Energy, Inc., an independent oil and natural gas company, acquires, develops, explores, and exploits unconventional, onshore oil and natural gas reserves in the Permian Basin in West Texas. It focuses on the development of the Spraberry and Wolfcamp formations of the Midland basin; and the Wolfcamp and Bone Spring formations of the Delaware basin, which are part of the Permian Basin in West Texas and New Mexico. The company also owns and operates midstream infrastructure assets, in the Midland and Delaware Basins of the Permian Basin. Diamondback Energy, Inc. was founded in 2007 and is headquartered in Midland, Texas.",1023,"{'maxAge': 1, 'name': 'Mr. Travis D. Stice', 'age': 61, 'title': 'CEO & Chairman of the Board', 'yearBorn': 1962, 'fiscalYear': 2022, 'totalPay': 3518019, 'exercisedValue': 0, 'unexercisedValue': 0}",7,6,1,5,4,1709251200,1672444800,86400,2,180.06,180.99,179.3,181.8253,180.06,180.99,179.3,181.8253,8.12,0.045100003,1709510400,0.46080002,3.19,1.912,10.459054,9.290983,587181,587181,1954638,1847730,1847730,180.72,180.93,900,1800,32363149312,119.01,185.78,4.066233,161.2722,150.9191,8.12,0.04509608,USD,39158091776,0.39490002,175582515,178447008,5058946,5819101,1705017600,1707955200,0.028399998,0.0055199997,0.93571997,2.33,0.0325,178447008,93.021,1.9496672,1703980800,1735603200,1703980800,-0.047,3120999936,17.34,19.52,5.23,,,4.92,6.432,0.26366758,0.27220368,3.08,1709510400,NMS,EQUITY,FANG,FANG,"Diamondback Energy, Inc.","Diamondback Energy, Inc.",1350048600,America/New_York,EST,7f448654-4da6-3c99-be09-c9bfe680da59,finmb_170245760,-18000000,181.36,250.0,154.0,194.76,192.0,2.0,buy,25,582000000,3.261,6088000000,6803999744,0.678,0.769,7959000064,39.036,44.217,0.09831,0.20145,273624992,5920000000,-0.051,0.113,0.84043,0.76492,0.59369,USD,,Suite 100,,
150,D,120 Tredegar Street,Richmond,VA,23219,United States,804 819 2284,https://www.dominionenergy.com,Utilities - Regulated Electric,utilities-regulated-electric,Utilities - Regulated Electric,Utilities,utilities,Utilities,"Dominion Energy, Inc. produces and distributes energy in the United States. It operates through three operating segments: Dominion Energy Virginia, Dominion Energy South Carolina, and Contracted Energy. The Dominion Energy Virginia segment generates, transmits, and distributes regulated electricity to approximately 2.8 million residential, commercial, industrial, and governmental customers in Virginia and North Carolina. The Dominion Energy South Carolina segment generates, transmits, and distributes electricity to approximately 0.8 million customers in the central, southern, and southwestern portions of South Carolina; and distributes natural gas to approximately 0.4 million residential, commercial, and industrial customers in South Carolina. The Contracted Energy segment is involved in the nonregulated long-term contracted renewable electric generation and renewable natural gas facility. As of December 31, 2023, the company's portfolio of assets included approximately 29.5 gigawatt of electric generating capacity; 10,600 miles of electric transmission lines; 79,300 miles of electric distribution lines; and 94,800 miles of gas distribution mains and related service facilities. The company was formerly known as Dominion Resources, Inc. Dominion Energy, Inc. was incorporated in 1983 and is headquartered in Richmond, Virginia.",17700,"{'maxAge': 1, 'name': 'Mr. Robert M. Blue', 'age': 55, 'title': 'President, CEO & Chairman of the Board', 'yearBorn': 1968, 'fiscalYear': 2022, 'totalPay': 3464842, 'exercisedValue': 0, 'unexercisedValue': 0}",2,6,3,6,3,1709251200,1672444800,86400,2,46.1,46.81,46.43,47.255,46.1,46.81,46.43,47.255,2.67,0.0579,1709164800,1.0766001,4.39,0.608,18.983871,13.928994,3592169,3592169,5461983,8585880,8585880,47.06,47.08,800,900,39426818048,39.18,58.69,2.739305,46.2976,47.65275,2.67,0.057917573,USD,85328134144,0.13854,835383147,837443008,11939623,8967630,1705017600,1707955200,0.014199999,0.00132,0.74505997,2.67,0.0143,837443008,30.723,1.5324025,1703980800,1735603200,1703980800,-0.175,2076000000,2.48,3.38,-3.02,2:1,1195516800,5.928,11.815,-0.16120815,0.27220368,0.668,1709164800,NYQ,EQUITY,D,D,"Dominion Energy, Inc.","Dominion Energy, Inc.",322151400,America/New_York,EST,f623e75a-f30e-32bb-973d-6df5b50bb7b5,finmb_267105,-18000000,47.08,61.0,40.0,49.29,49.0,2.8,hold,14,184000000,0.22,7222000128,45122998272,0.11,1.037,14392999936,163.911,17.208,0.023929998,0.07817,-14229499904,6572000256,-0.207,-0.071,0.48343,0.50176996,0.24052,USD,,,,
153,DOW,2211 H.H. Dow Way,Midland,MI,48674,United States,989 636 1000,https://www.dow.com,Chemicals,chemicals,Chemicals,Basic Materials,basic-materials,Basic Materials,"Dow Inc., through its subsidiaries, engages in the provision of various materials science solutions for packaging, infrastructure, mobility, and consumer applications in the United States, Canada, Europe, the Middle East, Africa, India, the Asia Pacific, and Latin America. The company operates through Packaging & Specialty Plastics, Industrial Intermediates & Infrastructure, and Performance Materials & Coatings segments. The Packaging & Specialty Plastics segment provides ethylene, and propylene and aromatics products; and polyethylene, polyolefin elastomers, ethylene vinyl acetate, and ethylene propylene diene monomer rubbers for mobility and transportation, consumer, wire and cable, and construction end-markets. The Industrial Intermediates & Infrastructure segment offers purified ethylene, ethylene and ethanol amines, propylene glycol and polyether polyols, aromatic isocyanates and coatings, adhesives, sealants, elastomers, and composites. This segment also provides caustic soda, and ethylene dichloride and vinyl chloride monomers; and cellulose ethers, redispersible latex powders, and acrylic emulsions. The Performance Materials and Coatings segment provides architectural paints and coatings, and industrial coatings that are used in maintenance and protective industries, wood, metal packaging, traffic markings, thermal paper, and leather; and silicon metal, siloxanes, and intermediates used as key materials in manufacturing differentiated downstream silicone products. It also engages in property and casualty insurance, as well as reinsurance business. Dow Inc. was incorporated in 2018 and is headquartered in Midland, Michigan.",35900,"{'maxAge': 1, 'name': 'Mr. James R. Fitterling', 'age': 61, 'title': 'Chairman & CEO', 'yearBorn': 1962, 'fiscalYear': 2023, 'totalPay': 5256559, 'exercisedValue': 137695, 'unexercisedValue': 4173916}",1,8,2,5,2,1709251200,1703980800,86400,2,56.98,57.95,56.83,58.1,56.98,57.95,56.83,58.1,2.8,0.049099997,1709078400,3.4146,,1.305,69.64634,13.219907,2169452,2169452,4515363,5017700,5017700,56.98,56.99,800,900,40433250304,47.26,58.1,0.90612817,54.538,52.76025,2.8,0.049140047,USD,52698681344,0.013200001,699266548,707988992,12701595,10938269,1705017600,1707955200,0.018099999,0.00182,0.65916,2.62,0.018099999,707988992,26.495,2.155501,1703980800,1735603200,1703980800,,578000000,0.82,4.32,0.64,,,1.181,10.181,0.012797713,0.27220368,0.7,1709078400,NYQ,EQUITY,DOW,DOW,Dow Inc.,Dow Inc.,1553088600,America/New_York,EST,9510e206-86db-3ea5-bd8f-fbd901232728,finmb_9830660,-18000000,57.11,67.0,47.0,56.6,56.0,2.8,hold,20,4288000000,6.106,5176000000,16469000192,0.925,1.769,44622000128,86.189,63.231,0.027780002,0.03271,2639624960,5196000256,,-0.104,0.11333,0.116000004,0.03182,USD,0.7708,,989 832 1456,
155,DTE,One Energy Plaza,Detroit,MI,48226-1279,United States,313 235 4000,https://www.dteenergy.com,Utilities - Regulated Electric,utilities-regulated-electric,Utilities - Regulated Electric,Utilities,utilities,Utilities,"DTE Energy Company engages in the utility operations. The company's Electric segment generates, purchases, distributes, and sells electricity to various residential, commercial, and industrial customers in southeastern Michigan. It generates electricity through coal-fired plants, hydroelectric pumped storage, and nuclear plants, as well as wind and solar assets. This segment owns and operates distribution substations and line transformers. The company's Gas segment purchases, stores, transports, distributes, and sells natural gas to various residential, commercial, and industrial customers throughout Michigan; and sells storage and transportation capacity. Its DTE Vantage segment offers metallurgical and petroleum coke to steel and other industries; and power generation, steam production, chilled water production, and wastewater treatment services, as well as air supplies compressed air to industrial customers. Its Energy Trading segment engages in power, natural gas, and environmental marketing and trading; structured transactions; and the optimization of contracted natural gas pipeline transportation and storage positions. The company was founded in 1849 and is based in Detroit, Michigan.",9950,"{'maxAge': 1, 'name': 'Mr. Gerardo  Norcia', 'age': 60, 'title': 'CEO & Chairman', 'yearBorn': 1963, 'fiscalYear': 2022, 'totalPay': 3407031, 'exercisedValue': 0, 'unexercisedValue': 0}",9,9,5,3,6,1709251200,1672444800,86400,2,109.99,111.0,110.875,112.16,109.99,111.0,110.875,112.16,4.08,0.037100002,1710460800,0.5736,3.27,0.642,16.569527,15.622036,355526,355526,1168813,1107380,1107380,111.95,111.98,900,900,23124799488,90.14,116.73,1.8144213,107.2988,106.2154,3.878,0.035257753,USD,43656765440,0.109610006,205257622,206452992,2690678,2313615,1705017600,1707955200,0.012999999,0.00331,0.77078,2.07,0.0165,206452992,53.548,2.0917683,1703980800,1735603200,1703980800,0.581,1394000000,6.76,7.17,3.22,1175:1000,1625097600,3.425,12.909,0.024783373,0.27220368,1.02,1702598400,NYQ,EQUITY,DTE,DTE,DTE Energy Company,DTE Energy Company,-252322200,America/New_York,EST,4ecdc022-f62f-363d-a864-478a09d23b8a,finmb_266598,-18000000,112.01,129.0,108.0,116.97,117.0,2.2,buy,13,26000000,0.126,3382000128,20970000384,0.308,0.602,12744999936,189.688,61.869,0.03217,0.13022,-1108125056,3220000000,0.539,-0.242,0.33951,0.26536,0.20124,USD,1.8637,,,
156,DUK,525 South Tryon Street,Charlotte,NC,28202,United States,800 488 3853,https://www.duke-energy.com,Utilities - Regulated Electric,utilities-regulated-electric,Utilities - Regulated Electric,Utilities,utilities,Utilities,"Duke Energy Corporation, together with its subsidiaries, operates as an energy company in the United States. It operates through two segments: Electric Utilities and Infrastructure (EU&I), and Gas Utilities and Infrastructure (GU&I). The EU&I segment generates, transmits, distributes, and sells electricity in the Carolinas, Florida, and the Midwest. It generates electricity through coal, hydroelectric, natural gas, oil, solar and wind sources, renewables, and nuclear fuel. This segment also engages in the wholesale of electricity to municipalities, electric cooperative utilities, and load-serving entities. The GU&I segment distributes natural gas to residential, commercial, industrial, and power generation natural gas customers; and invests in pipeline transmission projects, renewable natural gas projects, and natural gas storage facilities. The company was formerly known as Duke Energy Holding Corp. and changed its name to Duke Energy Corporation in April 2006. Duke Energy Corporation was founded in 1904 and is headquartered in Charlotte, North Carolina.",27037,"{'maxAge': 1, 'name': 'Ms. Lynn J. Good', 'age': 63, 'title': 'Chairman, President & CEO', 'yearBorn': 1960, 'fiscalYear': 2022, 'totalPay': 5129334, 'exercisedValue': 0, 'unexercisedValue': 0}",1,4,1,4,1,1709251200,1672444800,86400,2,92.69,93.47,92.971,94.32,92.69,93.47,92.971,94.32,4.1,0.0442,1707955200,0.7589,4.1,0.46,17.571964,14.875,1898067,1898067,3346665,3543910,3543910,94.04,94.07,1100,800,72463941632,83.06,100.39,2.5335271,95.025,91.9609,4.06,0.04380192,USD,154875510784,0.09932999,768021109,770811008,10515205,10291801,1705017600,1707955200,0.0136,0.00131,0.66648,3.26,0.0137,770811008,61.154,1.5372666,1703980800,1735603200,1703980800,,4184000000,5.35,6.32,2.28,1:3,1341273600,5.415,11.654,-0.020914733,0.27220368,1.025,1707955200,NYQ,EQUITY,DUK,DUK,Duke Energy Corporation (Holdin,Duke Energy Corporation,322151400,America/New_York,EST,287ba1fd-2a9f-3c6f-b4a3-3d43e46d3ee9,finmb_267850,-18000000,94.01,120.0,89.0,103.25,100.0,2.4,buy,16,253000000,0.328,13288999936,80644997120,0.254,0.739,28601999360,160.689,37.097,0.02537,0.08485,-4369625088,9877999616,,-0.021,0.48451,0.46462002,0.28724,USD,2.3538,,,
162,EIX,2244 Walnut Grove Avenue,Rosemead,CA,91770,United States,(626) 302-2222,https://www.edison.com,Utilities - Regulated Electric,utilities-regulated-electric,Utilities - Regulated Electric,Utilities,utilities,Utilities,"Edison International, through its subsidiaries, engages in the generation and distribution of electric power. The company supplies and delivers electricity to approximately 50,000 square mile area of southern California to residential, commercial, industrial, public authorities, agricultural, and other sectors. Its transmission facilities consist of lines ranging from 55 kV to 500 kV and approximately 80 transmission substations; distribution system consists of approximately 38,000 circuit-miles of overhead lines; approximately 31,000 circuit-miles of underground lines; and 730 distribution substations. The company was founded in 1886 and is based in Rosemead, California.",13003,"{'maxAge': 1, 'name': 'Dr. Pedro J. Pizarro', 'age': 57, 'title': 'President, CEO & Director', 'yearBorn': 1966, 'fiscalYear': 2022, 'totalPay': 3354155, 'exercisedValue': 0, 'unexercisedValue': 2552002}",2,1,7,1,1,1709251200,1672444800,86400,2,67.11,67.75,67.445,68.5,67.11,67.75,67.445,68.5,3.12,0.0465,1711497600,0.9622,4.2,0.966,22.004824,12.286355,454917,454917,2510856,2522400,2522400,68.39,68.41,800,900,26314899456,58.82,74.92,1.6106561,68.3554,67.7953,2.993,0.04459842,USD,64887422976,0.07326,383443763,384524000,6559453,4046440,1705017600,1707955200,0.0171,0.0017299999,0.91630995,2.16,0.024600001,384524000,36.017,1.900075,1703980800,1735603200,1703980800,-0.089,1196999936,3.11,5.57,1.85,2:1,740707200,3.972,10.873,-0.017279267,0.27220368,0.78,1703721600,NYQ,EQUITY,EIX,EIX,Edison International,Edison International,105283800,America/New_York,EST,37bf455b-98ec-3083-a6aa-3e0a83daa0ef,finmb_301891,-18000000,68.435,86.0,58.0,73.96,76.0,2.3,buy,15,345000000,0.897,5968000000,35311001600,0.361,0.792,16337999872,196.784,42.658,0.028199999,0.0675,-2384624896,3400999936,-0.085,-0.077,0.58453,0.36528,0.25742,USD,0.7171,PO Box 976,(651) 450-4033,
