122,ED,4 Irving Place,New York,NY,10003,United States,212 460 4600,https://www.conedison.com,Utilities - Regulated Electric,utilities-regulated-electric,Utilities - Regulated Electric,Utilities,utilities,Utilities,"Consolidated Edison, Inc., through its subsidiaries, engages in the regulated electric, gas, and steam delivery businesses in the United States. It offers electric services to approximately 3.7 million customers in New York City and Westchester County; gas to approximately 1.1 million customers in Manhattan, the Bronx, parts of Queens, and Westchester County; and steam to approximately 1,530 customers in parts of Manhattan. The company also supplies electricity to approximately 0.3 million customers in southeastern New York and northern New Jersey; and gas to approximately 0.2 million customers in southeastern New York. In addition, it operates 545 circuit miles of transmission lines; 15 transmission substations; 63 distribution substations; 90,051 in-service line transformers; 3,788 pole miles of overhead distribution lines; and 2,314 miles of underground distribution lines, as well as 4,363 miles of mains and 380,870 service lines for natural gas distribution. Further, the company invests in electric and gas transmission projects. It primarily sells electricity to industrial, commercial, residential, and government customers. Consolidated Edison, Inc. was founded in 1823 and is based in New York, New York.",14592,"{'maxAge': 1, 'name': 'Mr. Timothy P. Cawley', 'age': 58, 'title': 'Chairman, President & CEO', 'yearBorn': 1965, 'fiscalYear': 2022, 'totalPay': 3515347, 'exercisedValue': 0, 'unexercisedValue': 0}",9,5,1,4,4,1709251200,1672444800,86400,2,87.01,86.56,86.56,88.66,87.01,86.56,86.56,88.66,3.32,0.0382,1707782400,0.44939998,3.66,0.351,12.270319,15.798037,1071092,1071092,1873206,1777330,1777330,88.48,88.49,800,800,30566926336,80.46,100.92,2.0846298,89.84,90.5463,3.24,0.037237097,USD,53883826176,0.17179,344590974,345510016,6989327,6810356,1705017600,1707955200,0.0202,0.0013400001,0.68455005,3.62,0.0273,345510016,61.254,1.4442976,1703980800,1735603200,1703980800,0.758,2519000064,7.21,5.6,2.87,2:1,615427200,3.675,10.551,-0.050420165,0.2689098,0.83,1707782400,NYQ,EQUITY,ED,ED,"Consolidated Edison, Inc.","Consolidated Edison, Inc.",-252322200,America/New_York,EST,4e67af4d-9f8c-3d24-8c2f-eead828efbf6,finmb_263295,-18000000,88.469,96.0,73.0,89.75,92.0,3.1,hold,12,1188999936,3.441,5106999808,25009999872,0.77,1.012,14663000064,118.206,42.171,0.028399998,0.11968,1446625024,2156000000,0.821,-0.146,0.50501,0.34829,0.34756002,USD,2.5036,,,
127,GLW,One Riverfront Plaza,Corning,NY,14831,United States,607-974-9000,https://www.corning.com,Electronic Components,electronic-components,Electronic Components,Technology,technology,Technology,"Corning Incorporated engages in the display technologies, optical communications, environmental technologies, specialty materials, and life sciences businesses in the United States and internationally. The company's Display Technologies segment offers glass substrates for flat panel displays, including liquid crystal displays and organic light-emitting diodes that are used in televisions, notebook computers, desktop monitors, tablets, and handheld devices. Its Optical Communications segment provides optical fibers and cables; and hardware and equipment products, such as cable assemblies, fiber optic hardware and connectors, optical components and couplers, closures, network interface devices, and other accessories for the telecommunications industry, businesses, governments, and individuals. The company's Specialty Materials segment manufactures products that offer material formulations for glass, glass ceramics, crystals, precision metrology instruments, and software, as well as glass wafers and substrates, tinted sunglasses, and radiation shielding products for various markets comprising mobile consumer electronics, semiconductor equipment optics and consumables, aerospace and defense optics, radiation shielding products, sunglasses, and telecommunications components. Its Environmental Technologies segment provides ceramic substrates and filter products for emissions control in mobile, gasoline, and diesel applications. The company's Life Sciences segment offers laboratory products, including consumables, such as plastic vessels, liquid handling plastics, specialty surfaces, cell culture media, and serum, as well as general labware, and glassware and equipment under the Corning, Pyrex, Falcon, and Axygen brands. The company was formerly known as Corning Glass Works and changed its name to Corning Incorporated in April 1989. Corning Incorporated was founded in 1851 and is headquartered in Corning, New York.",49800,"{'maxAge': 1, 'name': 'Mr. Wendell P. Weeks', 'age': 63, 'title': 'Chairman & CEO', 'yearBorn': 1960, 'fiscalYear': 2022, 'totalPay': 5508245, 'exercisedValue': 3530831, 'unexercisedValue': 2843958}",7,6,9,6,8,1709251200,1672444800,86400,2,32.45,32.36,32.28,33.56,32.45,32.36,32.28,33.56,1.12,0.0345,1709078400,1.6471001,2.91,1.074,49.16912,15.479167,3501989,3501989,4749313,4147990,4147990,33.45,33.46,1200,1100,28535904256,25.26,36.02,2.2669132,31.2672,31.12915,1.12,0.034514636,USD,34717241344,0.04616,766641840,853473984,10718269,10240276,1705017600,1707955200,0.0126,0.096920006,0.71178,2.02,0.0126,853473984,14.087,2.373465,1703980800,1735603200,1703980800,,581000000,0.68,2.16,2.44,3:1,970617600,2.758,12.892,-0.085142374,0.2689098,0.28,1709078400,NYQ,EQUITY,GLW,GLW,Corning Incorporated,Corning Incorporated,378657000,America/New_York,EST,00ec92fb-b808-359d-ab84-18e395eb0a3b,finmb_173840,-18000000,33.435,40.0,29.0,34.7,35.0,2.3,buy,10,1779000064,2.084,2692999936,8483999744,0.776,1.67,12588000256,71.486,14.844,0.02853,0.05368,214875008,2004999936,,-0.121,0.33476,0.21393,0.16433,USD,1.1431,,,
131,CTRA,Three Memorial City Plaza,Houston,TX,77024,United States,281 589 4600,https://www.coterra.com,Oil & Gas E&P,oil-gas-e-p,Oil & Gas E&P,Energy,energy,Energy,"Coterra Energy Inc., an independent oil and gas company, engages in the development, exploration, and production of oil, natural gas, and natural gas liquids in the United States. The company's properties include the Marcellus Shale with approximately 186,000 net acres in the dry gas window of the play located in Susquehanna County, Pennsylvania; Permian Basin properties with approximately 296,000 net acres located in west Texas and southeast New Mexico; and Anadarko Basin properties with approximately 182,000 net acres located in Oklahoma. It also operates natural gas and saltwater gathering and disposal systems in Texas. The company sells its natural gas to industrial customers, local distribution companies, oil and gas marketers, major energy companies, pipeline companies, and power generation facilities. Coterra Energy Inc. was incorporated in 1989 and is headquartered in Houston, Texas.",894,"{'maxAge': 1, 'name': 'Mr. Thomas E. Jorden', 'age': 66, 'title': 'CEO, President & Chairman', 'yearBorn': 1957, 'fiscalYear': 2022, 'totalPay': 2748736, 'exercisedValue': 0, 'unexercisedValue': 0}",7,8,4,3,5,1709251200,1672444800,86400,2,25.96,26.28,26.36,26.8499,25.96,26.28,26.36,26.8499,0.84,0.0324,1710288000,0.5493,4.04,0.19,12.511736,9.253471,6200353,6200353,6848251,8585760,8585760,26.7,26.71,1400,1400,20036720640,22.25,29.89,3.5251093,25.1726,26.2168,1.17,0.045069337,USD,21095958528,0.28589,739381802,751846976,19789464,18012753,1705017600,1707955200,0.026400002,0.02037,0.8986,3.08,0.035,751846976,17.362,1.5349615,1703980800,1735603200,1703980800,-0.597,1620000000,2.13,2.88,-1.21,2:1,1376524800,3.711,5.559,0.011691332,0.2689098,0.2,1700006400,NYQ,EQUITY,CTRA,CTRA,Coterra Energy Inc.,Coterra Energy Inc.,634487400,America/New_York,EST,c4decc67-2d6f-374a-8909-cb881d5deb5f,finmb_258181,-18000000,26.65,39.0,25.0,31.06,30.0,2.2,buy,25,956000000,1.272,3795000064,2526000128,1.114,1.214,5683999744,19.361,7.519,0.06637,0.12638,1257500032,3657999872,-0.579,-0.302,0.72959,0.66766,0.3524,USD,,Suite 1400 840 Gessner Road,,
135,CVS,One CVS Drive,Woonsocket,RI,02895,United States,401 765 1500,https://www.cvshealth.com,Healthcare Plans,healthcare-plans,Healthcare Plans,Healthcare,healthcare,Healthcare,"CVS Health Corporation provides health solutions in the United States. It operates through Health Care Benefits, Health Services, and Pharmacy & Consumer Wellness segments. The Health Care Benefits segment offers traditional, voluntary, and consumer-directed health insurance products and related services. It serves employer groups, individuals, college students, part-time and hourly workers, health plans, health care providers, governmental units, government-sponsored plans, labor groups, and expatriates. The Health Services segment offers pharmacy benefit management solutions, including plan design and administration, formulary management, retail pharmacy network management, mail order pharmacy, specialty pharmacy and infusion, clinical, and disease and medical spend management services. It serves employers, insurance companies, unions, government employee groups, health plans, prescription drug plans, Medicaid managed care plans, CMS, plans offered on public health insurance and private health insurance exchanges, other sponsors of health benefit plans, and individuals. The Pharmacy & Consumer Wellness segment sells prescription and over-the-counter drugs, consumer health and beauty products, and personal care products. This segment also distributes prescription drugs; and provides related pharmacy consulting and other ancillary services to care facilities and other care settings. It operates online retail pharmacy websites, LTC pharmacies and on-site pharmacies, retail specialty pharmacy stores, compounding pharmacies and branches for infusion and enteral nutrition services. The company was formerly known as CVS Caremark Corporation and changed its name to CVS Health Corporation in September 2014. CVS Health Corporation was incorporated in 1996 and is headquartered in Woonsocket, Rhode Island.",219000,"{'maxAge': 1, 'name': 'Ms. Karen Sue Lynch', 'age': 60, 'title': 'President, CEO & Director', 'yearBorn': 1963, 'fiscalYear': 2022, 'totalPay': 4817125, 'exercisedValue': 0, 'unexercisedValue': 26139724}",7,4,4,7,5,1709251200,1672444800,86400,2,73.84,73.96,73.66,74.91,73.84,73.96,73.66,74.91,2.66,0.036,1705622400,0.374,2.87,0.499,11.45827,8.040672,4552972,4552972,11326901,8427900,8427900,74.03,74.03,1000,1200,93295198208,64.41,83.25,0.26160735,76.5198,71.8223,2.42,0.032773566,USD,161028915200,0.0234,1252333488,1258450048,30761242,42521469,1705017600,1707955200,0.024400001,0.00147,0.83048,2.44,0.024500001,1258450048,59.364,1.2488209,1703980800,1735603200,1703980800,-0.123,8344000000,6.47,9.22,2.49,2:1,1118102400,0.452,8.733,-0.11003977,0.2689098,0.665,1705622400,NYQ,EQUITY,CVS,CVS,CVS Health Corporation,CVS Health Corporation,99153000,America/New_York,EST,51332b8f-ec73-31f1-aeb5-259d61fabb3a,finmb_93625,-18000000,74.135,99.0,74.0,88.09,88.0,2.1,buy,23,11454999552,9.102,18439000064,79385001984,0.59,0.857,356622991360,103.587,277.528,0.0368,0.112770006,11075375104,13425999872,-0.105,0.12,0.1494,0.0517,0.03675,USD,1.0706,,401-652-0893,
137,DRI,1000 Darden Center Drive,Orlando,FL,32837,United States,407 245 4000,https://www.darden.com,Restaurants,restaurants,Restaurants,Consumer Cyclical,consumer-cyclical,Consumer Cyclical,"Darden Restaurants, Inc., together with its subsidiaries, owns and operates full-service restaurants in the United States and Canada. It operates under Olive Garden, LongHorn Steakhouse, Cheddar's Scratch Kitchen, Yard House, The Capital Grille, Seasons 52, Bahama Breeze, Eddie V's Prime Seafood, and Capital Burger brand names. Darden Restaurants, Inc. was incorporated in 1995 and is based in Orlando, Florida.",187384,"{'maxAge': 1, 'name': 'Mr. Ricardo  Cardenas', 'age': 55, 'title': 'CEO, President & Director', 'yearBorn': 1968, 'fiscalYear': 2023, 'totalPay': 2937503, 'exercisedValue': 1139146, 'unexercisedValue': 7632155}",7,3,2,1,2,1709251200,1703980800,86400,2,171.29,172.5,171.98,176.835,171.29,172.5,171.98,176.835,5.14,0.03,1704758400,0.6102,2.74,1.253,21.014528,17.894846,907891,907891,1031610,1152180,1152180,173.67,173.77,900,900,20727361536,133.36,176.835,1.8820643,163.8044,158.08176,5.04,0.029423784,USD,27313377280,0.09155,118567773,119411000,5784739,5326068,1705017600,1707955200,0.0484,0.0036199999,0.95085,6.22,0.0746,119411000,17.069,10.1693125,1685232000,1716854400,1700956800,0.133,1009500032,8.26,9.7,1.92,10000:8939,1447113600,2.48,16.008,0.15525734,0.2689098,1.31,1704758400,NYQ,EQUITY,DRI,DRI,"Darden Restaurants, Inc.","Darden Restaurants, Inc.",800026200,America/New_York,EST,19cb3c7b-5f7b-3bfc-b2af-6a8d397bf76d,finmb_336160,-18000000,173.58,193.0,154.0,178.32,180.0,2.0,buy,25,195700000,1.639,1706200064,7055200256,0.116,0.364,11013099520,345.894,91.13,0.07654,0.49722,760249984,1519000064,0.159,0.097,0.2084,0.15492,0.109560005,USD,2.0502,,,
143,DVN,333 West Sheridan Avenue,Oklahoma City,OK,73102-5015,United States,405 235 3611,https://www.devonenergy.com,Oil & Gas E&P,oil-gas-e-p,Oil & Gas E&P,Energy,energy,Energy,"Devon Energy Corporation, an independent energy company, engages in the exploration, development, and production of oil, natural gas, and natural gas liquids in the United States. It operates in Delaware, Eagle Ford, Anadarko, Williston, and Powder River Basins. The company was founded in 1971 and is headquartered in Oklahoma City, Oklahoma.",1900,"{'maxAge': 1, 'name': 'Mr. Richard E. Muncrief', 'age': 64, 'title': 'President, CEO & Director', 'yearBorn': 1959, 'fiscalYear': 2022, 'totalPay': 4119850, 'exercisedValue': 507800, 'unexercisedValue': 850788}",5,1,2,7,2,1709251200,1672444800,86400,2,44.39,44.53,44.245,44.715,44.39,44.53,44.245,44.715,2.42,0.0545,1710374400,0.4914,4.53,2.2,7.6344175,7.89115,3911707,3911707,8923148,8499280,8499280,44.67,44.68,1800,1000,28565610496,40.47,56.8,1.9800105,43.4494,47.0659,2.87,0.0646542,USD,33954861056,0.25972,627824855,640700032,14825986,14072670,1705017600,1707955200,0.0233,0.0073100002,0.70742995,1.85,0.026800001,653331968,18.973,2.3499184,1703980800,1735603200,1703980800,-0.041,3747000064,5.84,5.65,-2.79,2:1,1100563200,2.354,4.537,-0.21419722,0.2689098,0.77,1702512000,NYQ,EQUITY,DVN,DVN,Devon Energy Corporation,Devon Energy Corporation,490887000,America/New_York,EST,d14cc3ae-fc64-3a70-b4ac-a4ab70fd9067,finmb_266510,-18000000,44.585,75.0,46.0,52.68,52.0,2.2,buy,25,853000000,1.344,7484000256,6482999808,0.823,1.071,14426999808,53.065,22.577,0.12707,0.32169,1434499968,6544000000,-0.005,-0.121,0.54675,0.51875,0.41715,USD,,,,
145,FANG,500 West Texas Avenue,Midland,TX,79701,United States,(432) 221-7400,https://www.diamondbackenergy.com,Oil & Gas E&P,oil-gas-e-p,Oil & Gas E&P,Energy,energy,Energy,"Diamondback Energy, Inc., an independent oil and natural gas company, acquires, develops, explores, and exploits unconventional, onshore oil and natural gas reserves in the Permian Basin in West Texas. It focuses on the development of the Spraberry and Wolfcamp formations of the Midland basin; and the Wolfcamp and Bone Spring formations of the Delaware basin, which are part of the Permian Basin in West Texas and New Mexico. The company also owns and operates midstream infrastructure assets, in the Midland and Delaware Basins of the Permian Basin. Diamondback Energy, Inc. was founded in 2007 and is headquartered in Midland, Texas.",1023,"{'maxAge': 1, 'name': 'Mr. Travis D. Stice', 'age': 61, 'title': 'CEO & Chairman of the Board', 'yearBorn': 1962, 'fiscalYear': 2022, 'totalPay': 3518019, 'exercisedValue': 0, 'unexercisedValue': 0}",7,6,1,5,4,1709251200,1672444800,86400,2,182.09,183.1,179.2,183.1,182.09,183.1,179.2,183.1,8.12,0.0438,1709510400,0.46080002,3.19,1.912,10.353518,9.155023,679204,679204,1999415,2134870,2134870,179.91,180.2,800,900,32036591616,119.01,185.78,4.025203,160.3528,150.38655,8.12,0.044593334,USD,40069955584,0.39490002,175575377,178447008,5058946,5819101,1705017600,1707955200,0.028399998,0.0056800004,0.93569,2.33,0.0325,178447008,93.021,1.9299942,1703980800,1735603200,1703980800,-0.047,3120999936,17.34,19.61,5.13,,,5.035,6.582,0.2899338,0.2689098,3.37,1700006400,NMS,EQUITY,FANG,FANG,"Diamondback Energy, Inc.","Diamondback Energy, Inc.",1350048600,America/New_York,EST,7f448654-4da6-3c99-be09-c9bfe680da59,finmb_170245760,-18000000,179.53,250.0,154.0,193.84,189.0,2.0,buy,25,582000000,3.261,6088000000,6803999744,0.678,0.769,7959000064,39.036,44.217,0.09831,0.20145,273624992,5920000000,-0.051,0.113,0.84043,0.76492,0.59369,USD,,Suite 100,,
150,D,120 Tredegar Street,Richmond,VA,23219,United States,804 819 2284,https://www.dominionenergy.com,Utilities - Regulated Electric,utilities-regulated-electric,Utilities - Regulated Electric,Utilities,utilities,Utilities,"Dominion Energy, Inc. produces and distributes energy in the United States. It operates through three operating segments: Dominion Energy Virginia, Dominion Energy South Carolina, and Contracted Energy. The Dominion Energy Virginia segment generates, transmits, and distributes regulated electricity to approximately 2.8 million residential, commercial, industrial, and governmental customers in Virginia and North Carolina. The Dominion Energy South Carolina segment generates, transmits, and distributes electricity to approximately 0.8 million customers in the central, southern, and southwestern portions of South Carolina; and distributes natural gas to approximately 0.4 million residential, commercial, and industrial customers in South Carolina. The Contracted Energy segment is involved in the nonregulated long-term contracted renewable electric generation and renewable natural gas facility. As of December 31, 2023, the company's portfolio of assets included approximately 29.5 gigawatt of electric generating capacity; 10,600 miles of electric transmission lines; 79,300 miles of electric distribution lines; and 94,800 miles of gas distribution mains and related service facilities. The company was formerly known as Dominion Resources, Inc. Dominion Energy, Inc. was incorporated in 1983 and is headquartered in Richmond, Virginia.",17700,"{'maxAge': 1, 'name': 'Mr. Robert M. Blue', 'age': 55, 'title': 'President, CEO & Chairman of the Board', 'yearBorn': 1968, 'fiscalYear': 2022, 'totalPay': 3464842, 'exercisedValue': 0, 'unexercisedValue': 0}",2,6,3,6,3,1709251200,1672444800,86400,2,44.79,44.59,44.49,46.79,44.79,44.59,44.49,46.79,2.67,0.0596,1709164800,1.0766001,4.39,0.608,18.67742,13.704142,5942372,5942372,5422190,7935930,7935930,46.54,46.55,1800,1000,38790361088,39.18,58.69,2.6950853,46.3454,47.71905,2.67,0.05961152,USD,84231086080,0.13854,835408270,837443008,11939623,8967630,1705017600,1707955200,0.014199999,0.00132,0.74464,2.67,0.0143,837443008,30.723,1.5076653,1703980800,1735603200,1703980800,-0.175,2076000000,2.48,3.38,-3.02,2:1,1195516800,5.852,11.663,-0.19974989,0.2689098,0.668,1709164800,NYQ,EQUITY,D,D,"Dominion Energy, Inc.","Dominion Energy, Inc.",322151400,America/New_York,EST,f623e75a-f30e-32bb-973d-6df5b50bb7b5,finmb_267105,-18000000,46.32,61.0,40.0,49.79,49.0,2.8,hold,14,184000000,0.22,7222000128,45122998272,0.11,1.037,14392999936,163.911,17.208,0.023929998,0.07817,-14229499904,6572000256,-0.207,-0.071,0.48343,0.50176996,0.24052,USD,,,,
153,DOW,2211 H.H. Dow Way,Midland,MI,48674,United States,989 636 1000,https://www.dow.com,Chemicals,chemicals,Chemicals,Basic Materials,basic-materials,Basic Materials,"Dow Inc., through its subsidiaries, engages in the provision of various materials science solutions for packaging, infrastructure, mobility, and consumer applications in the United States, Canada, Europe, the Middle East, Africa, India, the Asia Pacific, and Latin America. The company operates through Packaging & Specialty Plastics, Industrial Intermediates & Infrastructure, and Performance Materials & Coatings segments. The Packaging & Specialty Plastics segment provides ethylene, and propylene and aromatics products; and polyethylene, polyolefin elastomers, ethylene vinyl acetate, and ethylene propylene diene monomer rubbers for mobility and transportation, consumer, wire and cable, and construction end-markets. The Industrial Intermediates & Infrastructure segment offers purified ethylene, ethylene and ethanol amines, propylene glycol and polyether polyols, aromatic isocyanates and coatings, adhesives, sealants, elastomers, and composites. This segment also provides caustic soda, and ethylene dichloride and vinyl chloride monomers; and cellulose ethers, redispersible latex powders, and acrylic emulsions. The Performance Materials and Coatings segment provides architectural paints and coatings, and industrial coatings that are used in maintenance and protective industries, wood, metal packaging, traffic markings, thermal paper, and leather; and silicon metal, siloxanes, and intermediates used as key materials in manufacturing differentiated downstream silicone products. It also engages in property and casualty insurance, as well as reinsurance business. Dow Inc. was incorporated in 2018 and is headquartered in Midland, Michigan.",35900,"{'maxAge': 1, 'name': 'Mr. James R. Fitterling', 'age': 61, 'title': 'Chairman & CEO', 'yearBorn': 1962, 'fiscalYear': 2023, 'totalPay': 5256559, 'exercisedValue': 137695, 'unexercisedValue': 4173916}",1,8,2,5,2,1709251200,1703980800,86400,2,55.77,55.53,55.48,57.105,55.77,55.53,55.48,57.105,2.8,0.0502,1709078400,3.4146,,1.305,69.347565,13.163195,3308208,3308208,4434686,4659510,4659510,57.04,57.04,900,1200,39935893504,47.26,58.25,0.89498216,54.448,52.70295,2.8,0.050206203,USD,51848904704,0.013200001,699266548,702292992,12701595,10938269,1705017600,1707955200,0.018099999,0.0017299999,0.66016,2.62,0.018099999,702292992,26.495,2.146254,1703980800,1735603200,1703980800,,578000000,0.82,4.32,0.63,,,1.162,10.017,-0.023463488,0.2689098,0.7,1709078400,NYQ,EQUITY,DOW,DOW,Dow Inc.,Dow Inc.,1553088600,America/New_York,EST,9510e206-86db-3ea5-bd8f-fbd901232728,finmb_9830660,-18000000,56.865,67.0,47.0,56.6,56.0,2.8,hold,20,4288000000,6.106,5176000000,16469000192,0.925,1.769,44622000128,86.189,63.231,0.027780002,0.03271,2639624960,5196000256,,-0.104,0.11333,0.116000004,0.03182,USD,0.7544,,989 832 1456,
155,DTE,One Energy Plaza,Detroit,MI,48226-1279,United States,313 235 4000,https://www.dteenergy.com,Utilities - Regulated Electric,utilities-regulated-electric,Utilities - Regulated Electric,Utilities,utilities,Utilities,"DTE Energy Company engages in the utility operations. The company's Electric segment generates, purchases, distributes, and sells electricity to various residential, commercial, and industrial customers in southeastern Michigan. It generates electricity through coal-fired plants, hydroelectric pumped storage, and nuclear plants, as well as wind and solar assets. This segment owns and operates distribution substations and line transformers. The company's Gas segment purchases, stores, transports, distributes, and sells natural gas to various residential, commercial, and industrial customers throughout Michigan; and sells storage and transportation capacity. Its DTE Vantage segment offers metallurgical and petroleum coke to steel and other industries; and power generation, steam production, chilled water production, and wastewater treatment services, as well as air supplies compressed air to industrial customers. Its Energy Trading segment engages in power, natural gas, and environmental marketing and trading; structured transactions; and the optimization of contracted natural gas pipeline transportation and storage positions. The company was founded in 1849 and is based in Detroit, Michigan.",9950,"{'maxAge': 1, 'name': 'Mr. Gerardo  Norcia', 'age': 60, 'title': 'CEO & Chairman', 'yearBorn': 1963, 'fiscalYear': 2022, 'totalPay': 3407031, 'exercisedValue': 0, 'unexercisedValue': 0}",9,9,5,3,6,1709251200,1672444800,86400,2,108.11,107.54,107.54,109.07,108.11,107.54,107.54,109.07,4.08,0.0377,1710460800,0.5736,3.27,0.642,16.099112,15.178522,276492,276492,1177578,1134020,1134020,108.85,108.89,900,1200,22468280320,90.14,116.73,1.7629094,107.3056,106.21325,3.878,0.035870872,USD,43268632576,0.109610006,205255558,206452992,2690678,2313615,1705017600,1707955200,0.012999999,0.00331,0.77071,2.07,0.0165,206452992,53.548,2.0323822,1703980800,1735603200,1703980800,0.581,1394000000,6.76,7.17,3.11,1175:1000,1625097600,3.395,12.794,-0.007436633,0.2689098,1.02,1702598400,NYQ,EQUITY,DTE,DTE,DTE Energy Company,DTE Energy Company,-252322200,America/New_York,EST,4ecdc022-f62f-363d-a864-478a09d23b8a,finmb_266598,-18000000,108.83,129.0,108.0,116.97,117.0,2.2,buy,13,26000000,0.126,3382000128,20970000384,0.308,0.602,12744999936,189.688,61.869,0.03217,0.13022,-1108125056,3220000000,0.539,-0.242,0.33951,0.26536,0.20124,USD,1.8318,,,
