354,OKE,100 West Fifth Street,Tulsa,OK,74103,United States,918 588 7000,https://www.oneok.com/,Oil & Gas Midstream,oil-gas-midstream,Oil & Gas Midstream,Energy,energy,Energy,"ONEOK, Inc. engages in gathering, processing, fractionation, storage, transportation, and marketing of natural gas and natural gas liquids (NGL) in the United States. It operates through four segments: Natural Gas Gathering and Processing, Natural Gas Liquids, Natural Gas Pipelines, and Refined Products and Crude. The company owns natural gas gathering pipelines and processing plants in the Mid-Continent and Rocky Mountain regions; and provides midstream services to producers of NGLs. It also owns NGL gathering and distribution pipelines in Oklahoma, Kansas, Texas, New Mexico, Montana, North Dakota, Wyoming, and Colorado; terminal and storage facilities in Kansas, Nebraska, Iowa, and Illinois; NGL distribution pipelines in Kansas, Nebraska, Iowa, Illinois, and Indiana; transports refined petroleum products, including unleaded gasoline and diesel; and owns and operates truck- and rail-loading, and -unloading facilities connected to NGL fractionation, storage, and pipeline assets. In addition, the company transports and stores natural gas through regulated interstate and intrastate natural gas transmission pipelines, and natural gas storage facilities. Further, it owns and operates a parking garage in downtown Tulsa, Oklahoma; and leases excess office space and rail cars. Additionally, the company transports, stores, and distributes refined products, NGLs, and crude oil, as well as conducts commodity-related activities, including liquids blending and marketing activities. It serves integrated and independent exploration and production companies; other NGL and natural gas gathering and processing companies; crude oil and natural gas production companies; utilities; industrial companies; natural gasoline distributors; propane distributors; municipalities; ethanol producers; petrochemical, refining, and marketing companies; and heating fuel users, refineries, and exporters. ONEOK, Inc. was founded in 1906 and is headquartered in Tulsa, Oklahoma.",4775,"{'maxAge': 1, 'name': 'Mr. Pierce H. Norton II', 'age': 63, 'title': 'President, CEO & Director', 'yearBorn': 1960, 'fiscalYear': 2022, 'totalPay': 2520732, 'exercisedValue': 0, 'unexercisedValue': 0}",9,3,1,8,5,1709251200,1672444800,86400,2,77.52,77.77,76.86,77.91,77.52,77.77,76.86,77.91,3.96,0.0511,1706486400,0.6971,7.04,1.61,14.124088,13.89587,1271534,1271534,3619770,3727840,3727840,77.44,77.45,1000,800,45136506880,55.91,78.19,2.553403,70.912,66.16385,3.855,0.049729105,USD,66632519680,0.15042,580669355,583158976,11458712,12938351,1705017600,1707955200,0.0197,0.00366,0.70109004,3.72,0.0239,583158976,28.27,2.7378848,1703980800,1735603200,1703980800,0.419,2657999872,5.48,5.57,1.33,11422:10000,1391385600,3.769,15.79,0.15546286,0.27220368,0.99,1706486400,NYQ,EQUITY,OKE,OKE,"ONEOK, Inc.","ONEOK, Inc.",339255000,America/New_York,EST,112ea00e-e1f7-375a-b633-bcb48a6b1ec1,finmb_293889,-18000000,77.4,87.0,68.0,79.43,80.0,2.2,buy,17,338000000,0.58,4220000000,21763999744,0.592,0.9,17677000704,132.031,36.5,0.06284,0.23144,1230625024,4421000192,0.09,0.04,0.32516998,0.23873,0.21471001,USD,1.602,,,
367,PFE,66 Hudson Boulevard East,New York,NY,10001-2192,United States,212 733 2323,https://www.pfizer.com,Drug Manufacturers - General,drug-manufacturers-general,Drug Manufacturers - General,Healthcare,healthcare,Healthcare,"Pfizer Inc. discovers, develops, manufactures, markets, distributes, and sells biopharmaceutical products in the United States, Europe, and internationally. The company offers medicines and vaccines in various therapeutic areas, including cardiovascular metabolic, migraine, and women's health under the Eliquis, Nurtec ODT/Vydura, Zavzpret, and the Premarin family brands; infectious diseases with unmet medical needs under the Prevnar family, Abrysvo, Nimenrix, FSME/IMMUN-TicoVac, and Trumenba brands; and COVID-19 prevention and treatment, and potential future mRNA and antiviral products under the Comirnaty and Paxlovid brands. It also provides medicines and vaccines in various therapeutic areas, such as biosimilars for chronic immune and inflammatory diseases under the Xeljanz, Enbrel, Inflectra, Litfulo, Velsipity, and Cibinqo brands; amyloidosis, hemophilia, endocrine diseases, and sickle cell disease under the Vyndaqel family, Oxbryta, BeneFIX, Somavert, Ngenla, and Genotropin brands; sterile injectable and anti-infective medicines under the Sulperazon, Medrol, Zavicefta, Zithromax, and Panzyga brands; and biologics, small molecules, immunotherapies, and biosimilars under the Ibrance, Xtandi, Inlyta, Bosulif, Mektovi, Padcev, Adcetris, Talzenna, Tukysa, Elrexfio, Tivdak, Lorbrena, and Braftovi brands. In addition, the company involved in the contract manufacturing business. It serves wholesalers, retailers, hospitals, clinics, government agencies, pharmacies, individual provider offices, retail pharmacies, and integrated delivery systems. The company has collaboration agreements with Bristol-Myers Squibb Company; Astellas Pharma US, Inc.; Merck KGaA; and BioNTech SE. Pfizer Inc. was founded in 1849 and is headquartered in New York, New York.",88000,"{'maxAge': 1, 'name': 'Dr. Albert  Bourla D.V.M., Ph.D.', 'age': 61, 'title': 'Chairman of the Board & CEO', 'yearBorn': 1962, 'fiscalYear': 2022, 'totalPay': 11721071, 'exercisedValue': 0, 'unexercisedValue': 16848308}",10,6,3,1,5,1709251200,1672444800,86400,2,26.08,26.9,26.79,27.3,26.08,26.9,26.79,27.3,1.68,0.0644,1706140800,4.4323997,3.92,0.557,73.675674,10.774704,50813395,50813395,48260476,46900140,46900140,27.23,27.24,4000,3000,153931218944,25.61,42.22,2.6314828,27.8696,32.5129,1.64,0.06288344,USD,210183979008,0.03622,5635710739,5646779904,60680875,57575039,1705017600,1707955200,0.0107,0.0005,0.70128995,1.35,0.0107,5799450112,15.766,1.7290372,1703980800,1735603200,1703980800,,2134000000,0.37,2.53,-11.58,1054:1000,1605571200,3.593,18.25,-0.34995013,0.27220368,0.42,1706140800,NYQ,EQUITY,PFE,PFE,"Pfizer, Inc.",Pfizer Inc.,76253400,America/New_York,EST,72e0dcbd-2b61-3bbf-a98a-8b2df7c4850c,finmb_162270,-18000000,27.26,46.06,23.95,29.68,28.96,2.4,buy,23,12689999872,2.247,11516999680,75332001792,0.583,0.907,58496000000,84.37,10.366,0.01551,0.02347,1024249984,8700000256,,-0.413,0.5899,0.19689,-0.49967998,USD,0.2576,,,
370,PSX,2331 CityWest Boulevard,Houston,TX,77042,United States,832 765 3010,https://www.phillips66.com,Oil & Gas Refining & Marketing,oil-gas-refining-marketing,Oil & Gas Refining & Marketing,Energy,energy,Energy,"Phillips 66 operates as an energy manufacturing and logistics company in the United States, the United Kingdom, Germany, and internationally. It operates through four segments: Midstream, Chemicals, Refining, and Marketing and Specialties (M&S). The Midstream segment transports crude oil and other feedstocks; delivers refined petroleum products to market; provides terminaling and storage services for crude oil and refined petroleum products; transports, stores, fractionates, exports, and markets natural gas liquids; provides other fee-based processing services; and gathers, processes, transports, and markets natural gas. The Chemicals segment produces and markets ethylene and other olefin products; aromatics and styrenics products, such as benzene, cyclohexane, styrene, and polystyrene; and various specialty chemical products, including organosulfur chemicals, solvents, catalysts, and chemicals used in drilling and mining. The Refining segment refines crude oil and other feedstocks into petroleum products, such as gasolines, distillates, aviation, and renewable. The M&S segment purchases for resale and markets refined petroleum products, including gasolines, distillates, and aviation fuels. This segment also manufactures and markets specialty products, such as base oils and lubricants. Phillips 66 was founded in 1875 and is headquartered in Houston, Texas.",14000,"{'maxAge': 1, 'name': 'Mr. Greg C. Garland', 'age': 66, 'title': 'Executive Chairman', 'yearBorn': 1957, 'fiscalYear': 2022, 'totalPay': 5903707, 'exercisedValue': 7265523, 'unexercisedValue': 16385566}",9,5,9,9,9,1709251200,1672444800,86400,2,146.1,147.12,145.16,148.1,146.1,147.12,145.16,148.1,4.2,0.0287,1708041600,0.2713,4.3,1.356,9.5287285,10.257123,1390613,1390613,3160388,2631130,2631130,147.4,147.45,800,2200,63146823680,89.74,150.08,0.4284074,139.1222,118.03885,4.2,0.02874743,USD,80760152064,0.04759,425039292,427824000,9299835,8852695,1705017600,1707955200,0.0217,0.00409,0.78186995,2.77,0.0247,427824000,71.046,2.0775273,1703980800,1735603200,1703980800,-0.331,7004000256,15.49,14.39,-0.95,,,0.548,8.078,0.471151,0.27220368,1.05,1708041600,NYQ,EQUITY,PSX,PSX,Phillips 66,Phillips 66,1334237400,America/New_York,EST,6fbece3e-56c2-320b-b268-a2144205769e,finmb_27306532,-18000000,147.6,169.0,135.0,151.42,150.0,2.1,buy,16,3323000064,7.767,9996999680,20511000576,0.949,1.258,147399000064,64.806,327.454,0.06598,0.22017999,2446000128,7029000192,-0.28,-0.05,0.13103,0.06782,0.04319,USD,,,,
372,PXD,777 Hidden Ridge,Irving,TX,75038,United States,972 444 9001,https://www.pxd.com,Oil & Gas E&P,oil-gas-e-p,Oil & Gas E&P,Energy,energy,Energy,"Pioneer Natural Resources Company operates as an independent oil and gas exploration and production company in the United States. The company explores for, develops, and produces oil, natural gas liquids (NGLs), and gas. It has operations in the Midland Basin in West Texas. The company was founded in 1997 and is headquartered in Irving, Texas.",2213,"{'maxAge': 1, 'name': 'Mr. Richard P. Dealy', 'age': 57, 'title': 'CEO, President & Director', 'yearBorn': 1966, 'fiscalYear': 2022, 'totalPay': 1834803, 'exercisedValue': 0, 'unexercisedValue': 0}",9,3,2,8,6,1709251200,1672444800,86400,2,237.25,239.35,238.5,241.8399,237.25,239.35,238.5,241.8399,10.94,0.0461,1709251200,0.6907,4.03,1.329,11.913162,11.631159,1184720,1184720,2253003,2507970,2507970,241.08,241.04,1000,1100,56248242176,177.27,257.76,2.903285,228.018,226.40414,13.96,0.058840886,USD,60808085504,0.25261,231345296,233623008,6615971,5197928,1705017600,1707955200,0.028299998,0.00765,0.82008004,3.07,0.028499998,233623008,99.181,2.4275315,1703980800,1735603200,1703980800,-0.143,4885000192,20.21,20.7,6.11,,,3.139,6.54,0.16116881,0.27220368,2.56,1709251200,NYQ,EQUITY,PXD,PXD,Pioneer Natural Resources Compa,Pioneer Natural Resources Company,871047000,America/New_York,EST,45d9eec3-b269-3316-bcbd-b145de6455e5,finmb_295224,-18000000,240.765,306.0,220.0,251.95,245.0,2.9,hold,22,379000000,1.622,9297999872,5760000000,0.662,0.876,19374000128,24.859,82.795,0.1109,0.21412,2514249984,8448000000,-0.119,-0.019,0.51418996,0.47992,0.34160998,USD,,,,
373,PNC,The Tower at PNC Plaza,Pittsburgh,PA,15222-2401,United States,888 762 2265,https://www.pnc.com,Banks - Regional,banks-regional,Banks - Regional,Financial Services,financial-services,Financial Services,"The PNC Financial Services Group, Inc. operates as a diversified financial services company in the United States. It operates through three segments: Retail Banking, Corporate & Institutional Banking, and Asset Management Group segments. The company's Retail Banking segment offers checking, savings, and money market accounts, as well as time deposit; residential mortgages, home equity loans and lines of credit, auto loans, credit cards, education loans, and personal and small business loans and lines of credit; and brokerage, insurance, and investment and cash management services. This segment serves consumer and small business customers through a network of branches, digital channels, ATMs, and through phone-based customer contact centers. Its Corporate & Institutional Banking segment provides secured and unsecured loans, letters of credit, and equipment leases; cash and investment management services, receivables and disbursement management services, funds transfer services, international payment services, and access to online/mobile information management and reporting; securities underwriting, loan syndications, customer-related trading, and mergers and acquisitions and equity capital markets advisory related services; and commercial loan servicing and technology solutions. It serves mid-sized and large corporations, and government and not-for-profit entities. The company's Asset Management Group segment offers investment and retirement planning, customized investment management, credit and cash management solutions, and trust management and administration services for high net worth and ultra high net worth individuals, and their families; and multi-generational family planning services for ultra high net worth individuals and their families. It also provides outsourced chief investment officer, custody, private real estate, cash and fixed income client solutions, and retirement plan fiduciary investment services for institutional clients. The company was founded in 1852 and is headquartered in Pittsburgh, Pennsylvania.",54813,"{'maxAge': 1, 'name': 'Mr. William S. Demchak', 'age': 61, 'title': 'Chairman & CEO', 'yearBorn': 1962, 'fiscalYear': 2022, 'totalPay': 4473475, 'exercisedValue': 0, 'unexercisedValue': 0}",1,6,2,5,2,1709251200,1672444800,86400,2,155.12,148.81,147.09,152.66,155.12,148.81,147.09,152.66,6.15,0.0396,1705017600,0.47689998,3.45,1.157,11.821876,10.70913,3728021,3728021,2255041,2391340,2391340,151.45,151.65,800,1000,60196311040,109.4,157.69,2.9013069,150.2828,131.94016,6.1,0.039324395,USD,136121991168,0.26885,393706710,397808000,5066587,6059599,1705017600,1707955200,0.0127,0.00365,0.84758,2.23,0.0128,397808000,112.724,1.3423939,1703980800,1735603200,1703980800,-0.435,5126000128,12.8,14.13,1.06,2:1,721872000,6.561,,0.06883478,0.27220368,1.55,1705017600,NYQ,EQUITY,PNC,PNC,"PNC Financial Services Group, I","The PNC Financial Services Group, Inc.",185466600,America/New_York,EST,75d3d3f2-357a-3484-9613-24827c7dcdde,finmb_294585,-18000000,151.32,199.0,141.0,163.36,163.44,2.4,buy,20,10136000512,25.48,,78273003520,,,20747999232,,51.741,0.010089999,0.11649,,10110999552,-0.464,-0.042,,,0.20569,USD,4.0111,300 Fifth Avenue,,
381,PRU,751 Broad Street,Newark,NJ,07102,United States,973 802 6000,https://www.prudential.com,Insurance - Life,insurance-life,Insurance - Life,Financial Services,financial-services,Financial Services,"Prudential Financial, Inc., together with its subsidiaries, provides insurance, investment management, and other financial products and services in the United States and internationally. It operates through PGIM, Retirement Strategies, Group Insurance, Individual Life, and International Businesses segments. The PGIM segment offers investment management services and solutions related to public fixed income, public equity, real estate debt and equity, private credit and other alternatives, and multi-asset class strategies to institutional and retail clients, as well as its general account. The Retirement Strategies segment provides a range of retirement investment, and income products and services to retirement plan sponsors in the public, private, and not-for-profit sectors; develops and distributes individual variable and fixed annuity products. The Group Insurance segment offers various group life, and long-term and short-term group disability, as well as group corporate-, bank-, and trust-owned life insurance in the United States primarily for institutional clients for use in connection with employee and membership benefits plans; sells accidental death and dismemberment, and other supplemental health solutions; and plan administration services in connection with its insurance coverages. The Individual Life segment develops and distributes variable life, universal life, and term life insurance products. The International Businesses segment develops and distributes life insurance, retirement products, investment products, and certain accident and health products; and advisory services. The company provides its products and services to individual and institutional customers through its proprietary and third-party distribution networks. Prudential Financial, Inc. was founded in 1875 and is headquartered in Newark, New Jersey.",40366,"{'maxAge': 1, 'name': 'Mr. Charles Frederick Lowrey Jr.', 'age': 65, 'title': 'Chairman, CEO & President', 'yearBorn': 1958, 'fiscalYear': 2022, 'totalPay': 6577154, 'exercisedValue': 0, 'unexercisedValue': 731525}",2,4,1,1,1,1709251200,1672444800,86400,2,108.93,109.52,108.1101,109.81,108.93,109.52,108.1101,109.81,5.2,0.0477,1708041600,0.7418,4.99,1.358,16.232939,7.519588,583073,583073,1711870,1527490,1527490,109.3,109.33,1000,1200,39301824512,75.37,110.12,0.7280947,105.3026,95.8082,5.0,0.045901038,USD,40576868352,0.046090003,357420400,359216000,5765993,6292888,1705017600,1707955200,0.0161,0.0016500001,0.58453,3.32,0.0161,359216000,77.446,1.4127264,1703980800,1735603200,1703980800,,2459000064,6.74,14.55,0.67,,,0.752,12.37,0.14989972,0.27220368,1.3,1708041600,NYQ,EQUITY,PRU,PRU,"Prudential Financial, Inc.","Prudential Financial, Inc.",1008253800,America/New_York,EST,e7888e2d-0c76-30a5-b916-8b298017a4d2,finmb_1038328,-18000000,109.41,117.0,99.0,108.4,110.5,3.0,hold,10,34214000640,95.304,3280333312,33717999616,1.094,1.232,53979000832,113.197,148.498,0.00291,0.08129,2623375104,6510000128,,0.561,0.30012,0.06077,0.23973,USD,0.4269,,,
382,PEG,80 Park Plaza,Newark,NJ,07102,United States,973 430 7000,https://investor.pseg.com/home/default.aspx,Utilities - Regulated Electric,utilities-regulated-electric,Utilities - Regulated Electric,Utilities,utilities,Utilities,"Public Service Enterprise Group Incorporated, through its subsidiaries, operates in electric and gas utility business in the United States. It operates through PSE&G and PSEG Power segments. The PSE&G segment transmits electricity; distributes electricity and natural gas to residential, commercial, and industrial customers; and appliance services and repairs to customers through its service territory, as well as invests in solar generation projects, and energy efficiency and related programs. The PSEG Power segment engages in nuclear generation businesses; and supplies power and natural gas to nuclear power plants and gas storage facilities activities. As of December 31, 2023, it had electric transmission and distribution system of 25,000 circuit miles and 866,600 poles; 56 switching stations with an installed capacity of 39,953 megavolt-amperes (MVA), and 235 substations with an installed capacity of 10,382 MVA; 109 MVA aggregate installed capacity for substations; four electric distribution headquarters and five electric sub-headquarters; 18,000 miles of gas mains, 12 gas distribution headquarters, two sub-headquarters, and one meter shop, as well as 56 natural gas metering and regulating stations; and 158 MegaWatts defined conditions of installed PV solar capacity. Public Service Enterprise Group Incorporated was founded in 1903 and is based in Newark, New Jersey.",12543,"{'maxAge': 1, 'name': 'Mr. Ralph A. LaRossa', 'age': 60, 'title': 'Chair, President & CEO', 'yearBorn': 1963, 'fiscalYear': 2022, 'totalPay': 2160442, 'exercisedValue': 0, 'unexercisedValue': 0}",6,4,7,5,5,1709251200,1672444800,86400,2,64.21,64.64,64.23,64.91,64.21,64.64,64.23,64.91,2.4,0.0374,1709769600,0.44439998,3.39,0.585,12.639376,16.169575,1094131,1094131,2787481,3551040,3551040,64.81,64.82,800,800,32328380416,53.71,65.46,2.8769581,60.0028,61.1211,2.28,0.035508487,USD,52393246720,0.22809,496726868,498587008,6631671,6861193,1705017600,1707955200,0.013300001,0.00096000003,0.75565004,2.52,0.0150999995,498587008,31.078,2.0863633,1703980800,1735603200,1703980800,-0.307,2563000064,5.13,4.01,3.74,2:1,1202169600,4.663,10.92,0.087751985,0.27220368,0.57,1701907200,NYQ,EQUITY,PEG,PEG,Public Service Enterprise Group,Public Service Enterprise Group Incorporated,315671400,America/New_York,EST,a33c5c62-5f27-33a3-bdcb-d206fadd34fe,finmb_298482,-18000000,64.84,70.0,61.0,65.03,65.0,2.5,buy,15,54000000,0.108,4798000128,20433000448,0.354,0.667,11237000192,132.022,22.564,0.04366,0.17551,25750000,3806000128,-0.307,-0.17,0.42956,0.42698002,0.27868998,USD,1.6125,,,
392,RTX,1000 Wilson Boulevard,Arlington,VA,22209,United States,781 522 3000,https://www.rtx.com,Aerospace & Defense,aerospace-defense,Aerospace & Defense,Industrials,industrials,Industrials,"RTX Corporation, an aerospace and defense company, provides systems and services for the commercial, military, and government customers in the United States and internationally. It operates through three segments: Collins Aerospace, Pratt & Whitney, and Raytheon. The Collins Aerospace Systems segment offers aerospace and defense products, and aftermarket service solutions for civil and military aircraft manufacturers and commercial airlines, as well as regional, business, and general aviation, defense, and commercial space operations. This segment also designs, produces, and supports cabin interior, including oxygen systems, food and beverage preparation, storage and galley systems, and lavatory and wastewater management systems; battlespace, test and training range systems, crew escape systems, and simulation and training solutions; information management services; and aftermarket services that include spare parts, overhaul and repair, engineering and technical support, training and fleet management solutions, and asset and information management services. Its Pratt & Whitney segment supplies aircraft engines for commercial, military, business jet, and general aviation customers; and produces, sells, and services military and commercial auxiliary power units. The Raytheon segment provides defensive and offensive threat detection, tracking, and mitigation capabilities for U.S., foreign government, and commercial customers. The company was formerly known as Raytheon Technologies Corporation and changed its name to RTX Corporation in July 2023. RTX Corporation was incorporated in 1934 and is headquartered in Arlington, Virginia.",185000,"{'maxAge': 1, 'name': 'Mr. Gregory J. Hayes', 'age': 62, 'title': 'CEO & Chairman', 'yearBorn': 1961, 'fiscalYear': 2022, 'totalPay': 6821349, 'exercisedValue': 952016, 'unexercisedValue': 33913520}",6,6,5,2,3,1709251200,1672444800,86400,2,90.06,89.86,89.74,90.73,90.06,89.86,89.74,90.73,2.36,0.026199998,1708560000,1.0404,2.6,0.611,40.609863,14.8459015,2226062,2226062,7704601,7548570,7548570,90.43,90.43,1800,900,120157716480,68.56,104.91,1.7434375,88.4024,85.97045,2.32,0.025760604,USD,159933890560,0.04636,1199610764,1326829952,47145676,58260783,1705017600,1707955200,0.0355,0.00096000003,0.87424004,5.74,0.0356,1326829952,45.144,2.006025,1703980800,1735603200,1703980800,0.003,3195000064,2.23,6.1,1.53,15890:10000,1585872000,2.321,16.641,-0.075359344,0.27220368,0.59,1708560000,NYQ,EQUITY,RTX,RTX,RTX Corporation,RTX Corporation,-244546200,America/New_York,EST,ffd67fad-fdd4-3389-b63e-d608af877db5,finmb_159230,-18000000,90.56,112.0,70.0,94.62,95.0,2.8,hold,21,6586999808,4.973,9610999808,45587001344,0.632,1.035,68920000512,74.192,48.331,0.02105,0.049829997,5607875072,7882999808,0.091,0.101,0.17541,0.13945,0.11572,USD,0.7709,,,
411,SRE,488 8th Avenue,San Diego,CA,92101,United States,619 696 2000,https://www.sempra.com,Utilities - Diversified,utilities-diversified,Utilities - Diversified,Utilities,utilities,Utilities,"Sempra operates as an energy infrastructure company in the United States and internationally. It operates through three segments: Sempra California, Sempra Texas Utilities, and Sempra Infrastructure. The Sempra California segment provides electric services; and natural gas services to San Diego County. As of December 31, 2023, it offered electric services to approximately 3.6 million population and natural gas services to approximately 3.3 million population that covers 4,100 square miles. This segment owns and operates a natural gas distribution, transmission, and storage system that supplies natural gas. As of December 31, 2023, it serves a population of 21 million covering an area of 24,000 square miles. The Sempra Texas Utilities segment engages in the regulated electricity transmission and distribution. As of December 31, 2023, its transmission system included 18,298 circuit miles of transmission lines; 1,257 transmission and distribution substations; interconnection to 173 third-party generation facilities totaling 54,277 MW; and distribution system included approximately 4.0 million points of delivery and consisted of 125,116 miles of overhead and underground lines. The Sempra Infrastructure segment develops, builds, operates, and invests in energy infrastructure to help enable the energy transition in North American markets and worldwide. The company was formerly known as Sempra Energy and changed its name to Sempra in May 2023. Sempra was founded in 1998 and is based in San Diego, California.",16835,"{'maxAge': 1, 'name': 'Mr. Jeffrey Walker Martin', 'age': 60, 'title': 'Chairman, President & CEO', 'yearBorn': 1963, 'fiscalYear': 2022, 'totalPay': 6489368, 'exercisedValue': 0, 'unexercisedValue': 1906442}",8,2,9,3,7,1709251200,1672444800,86400,2,70.21,70.69,70.36,71.15,70.21,70.69,70.36,71.15,2.48,0.0353,1710892800,0.4969,3.07,0.714,14.800626,13.739341,1151317,1151317,2960105,3103740,3103740,70.88,70.89,1000,1100,44816273408,63.75,79.515,2.6803992,72.3308,72.06193,2.38,0.03389831,USD,82067243008,0.18385,630632756,632150016,12672169,12705308,1705017600,1707955200,0.0201,0.00043000001,0.91420996,4.48,0.0201,632150016,44.005,1.6110668,1703980800,1735603200,1703980800,0.666,3030000128,4.79,5.16,2.47,2:1,1692662400,4.908,14.062,-0.05517429,0.27220368,0.595,1701734400,NYQ,EQUITY,SRE,SRE,DBA Sempra,Sempra,899127000,America/New_York,EST,b972b330-bcbc-3220-8032-58f963c87063,finmb_120622,-18000000,70.895,94.0,74.0,82.62,82.0,2.0,buy,17,236000000,0.373,5836000256,32052000768,0.306,0.542,16720000000,95.24,26.527,0.02722,0.114989996,-3012124928,6217999872,0.682,0.01,0.35537997,0.34904,0.18705,USD,,,,
