333,NEM,6900 E Layton Avenue,Denver,CO,80237,United States,303 863 7414,https://www.newmont.com,Gold,gold,Gold,Basic Materials,basic-materials,Basic Materials,"Newmont Corporation engages in the production and exploration of gold. It also explores for copper, silver, zinc, and lead. The company has operations and/or assets in the United States, Canada, Mexico, Dominican Republic, Peru, Suriname, Argentina, Chile, Australia, Papua New Guinea, Ecuador, Fiji, and Ghana. The company was founded in 1916 and is headquartered in Denver, Colorado.",21700,"{'maxAge': 1, 'name': 'Mr. Thomas Ronald Palmer', 'age': 55, 'title': 'President, CEO & Director', 'yearBorn': 1968, 'fiscalYear': 2022, 'totalPay': 3455781, 'exercisedValue': 0, 'unexercisedValue': 0}",7,9,6,5,6,1709251200,1672444800,86400,2,31.69,31.72,31.685,33.1176,31.69,31.72,31.685,33.1176,1.0,0.0313,1709510400,1.8033,2.93,0.498,,10.114159,16521048,16521048,12114346,16952580,16952580,32.98,32.99,1000,1100,38116646912,29.42,52.76,3.2269428,35.7406,39.00575,1.45,0.04575576,USD,43506499584,-0.21114,1149186156,1152489984,17962228,19704094,1705017600,1707955200,0.0156,0.00103,0.71599,1.6,0.016900001,1152489984,25.185,1.3132142,1703980800,1735603200,1703980800,,-2520999936,-3.0,3.27,,5:4,766972800,3.683,14.213,-0.2777024,0.2689098,0.4,1701216000,NYQ,EQUITY,NEM,NEM,Newmont Corporation,Newmont Corporation,322151400,America/New_York,EST,929aada3-7972-3cb7-8655-cc6532c8ea50,finmb_291795,-18000000,33.0733,82.41,58.12,68.18,64.01,2.3,buy,3,3024999936,2.625,3060999936,9541000192,0.709,1.252,11811999744,32.669,14.045,0.00942,-0.102340005,-724374976,2763000064,,0.237,0.30308,0.25913998,-0.118269995,USD,,Suite 700,303 837 5837,
336,NEE,700 Universe Boulevard,Juno Beach,FL,33408,United States,561 694 4000,https://www.nexteraenergy.com,Utilities - Regulated Electric,utilities-regulated-electric,Utilities - Regulated Electric,Utilities,utilities,Utilities,"NextEra Energy, Inc., through its subsidiaries, generates, transmits, distributes, and sells electric power to retail and wholesale customers in North America. The company generates electricity through wind, solar, nuclear,natural gas, and other clean energy. It also develops, constructs, and operates long-term contracted assets that consists of clean energy solutions, such as renewable generation facilities, battery storage projects, and electric transmission facilities; sells energy commodities; and owns, develops, constructs, manages and operates electric generation facilities in wholesale energy markets. The company had approximately 33,276 megawatts of net generating capacity; approximately 90,000 circuit miles of transmission and distribution lines; and 883 substations. It serves approximately 12 million people through approximately 5.9 million customer accounts in the east and lower west coasts of Florida. The company was formerly known as FPL Group, Inc. and changed its name to NextEra Energy, Inc. in 2010. NextEra Energy, Inc. was founded in 1925 and is headquartered in Juno Beach, Florida.",16800,"{'maxAge': 1, 'name': 'Mr. John W. Ketchum', 'age': 52, 'title': 'President, CEO & Chairman', 'yearBorn': 1971, 'fiscalYear': 2022, 'totalPay': 6315189, 'exercisedValue': 0, 'unexercisedValue': 18277844}",7,4,6,3,4,1709251200,1672444800,86400,2,55.21,54.78,53.95,55.07,55.21,54.78,53.95,55.07,2.06,0.0373,1708905600,0.5194,2.19,0.497,15.138889,14.850136,6690456,6690456,11233801,12707690,12707690,54.45,54.46,1400,900,111857434624,47.15,79.78,3.9787095,58.484,63.83465,1.87,0.033870675,USD,196247617536,0.26001,2044383632,2052429952,23766467,19190902,1705017600,1707955200,0.0116,0.00168,0.81341004,2.11,0.0116,2052429952,23.133,2.3559418,1703980800,1735603200,1703980800,-0.205,7310000128,3.6,3.67,2.16,4:1,1603756800,6.98,12.093,-0.2579301,0.2689098,0.515,1708905600,NYQ,EQUITY,NEE,NEE,"NextEra Energy, Inc.","NextEra Energy, Inc.",99153000,America/New_York,EST,c3b1de57-8c3a-3605-bc63-2c2a1fd29038,finmb_270586,-18000000,54.5,102.8,43.0,71.57,70.75,1.9,buy,20,2689999872,1.311,16227999744,74067001344,0.332,0.549,28113999872,125.486,13.876,0.03744,0.115839995,-16212374528,11301000192,-0.234,0.116,0.6394,0.57722,0.33833,USD,2.2871,,,
354,OKE,100 West Fifth Street,Tulsa,OK,74103,United States,918 588 7000,https://www.oneok.com/,Oil & Gas Midstream,oil-gas-midstream,Oil & Gas Midstream,Energy,energy,Energy,"ONEOK, Inc. engages in gathering, processing, fractionation, storage, transportation, and marketing of natural gas and natural gas liquids (NGL) in the United States. It operates through four segments: Natural Gas Gathering and Processing, Natural Gas Liquids, Natural Gas Pipelines, and Refined Products and Crude. The company owns natural gas gathering pipelines and processing plants in the Mid-Continent and Rocky Mountain regions; and provides midstream services to producers of NGLs. It also owns NGL gathering and distribution pipelines in Oklahoma, Kansas, Texas, New Mexico, Montana, North Dakota, Wyoming, and Colorado; terminal and storage facilities in Kansas, Nebraska, Iowa, and Illinois; NGL distribution pipelines in Kansas, Nebraska, Iowa, Illinois, and Indiana; transports refined petroleum products, including unleaded gasoline and diesel; and owns and operates truck- and rail-loading, and -unloading facilities connected to NGL fractionation, storage, and pipeline assets. In addition, the company transports and stores natural gas through regulated interstate and intrastate natural gas transmission pipelines, and natural gas storage facilities. Further, it owns and operates a parking garage in downtown Tulsa, Oklahoma; and leases excess office space and rail cars. Additionally, the company transports, stores, and distributes refined products, NGLs, and crude oil, as well as conducts commodity-related activities, including liquids blending and marketing activities. It serves integrated and independent exploration and production companies; other NGL and natural gas gathering and processing companies; crude oil and natural gas production companies; utilities; industrial companies; natural gasoline distributors; propane distributors; municipalities; ethanol producers; petrochemical, refining, and marketing companies; and heating fuel users, refineries, and exporters. ONEOK, Inc. was founded in 1906 and is headquartered in Tulsa, Oklahoma.",4775,"{'maxAge': 1, 'name': 'Mr. Pierce H. Norton II', 'age': 63, 'title': 'President, CEO & Director', 'yearBorn': 1960, 'fiscalYear': 2022, 'totalPay': 2520732, 'exercisedValue': 0, 'unexercisedValue': 0}",9,3,1,8,5,1709251200,1672444800,86400,2,75.13,76.86,75.69,76.88,75.13,76.86,75.69,76.88,3.96,0.052699998,1706486400,0.6971,7.04,1.61,14.000912,14.000912,2576340,2576340,3594585,3546250,3546250,76.8,76.81,800,1000,44742873088,55.91,76.88,2.5311348,70.5822,65.96235,3.855,0.051311065,USD,65238769664,0.15042,580669355,583158976,11458712,12938351,1705017600,1707955200,0.0197,0.00349,0.70107,3.72,0.0239,583158976,28.27,2.7140076,1703980800,1735603200,1703980800,0.419,2657999872,5.48,5.48,1.26,11422:10000,1391385600,3.691,15.459,0.09439182,0.2689098,0.99,1706486400,NYQ,EQUITY,OKE,OKE,"ONEOK, Inc.","ONEOK, Inc.",339255000,America/New_York,EST,112ea00e-e1f7-375a-b633-bcb48a6b1ec1,finmb_293889,-18000000,76.725,87.0,68.0,78.85,79.38,2.2,buy,17,338000000,0.58,4220000000,21763999744,0.592,0.9,17677000704,132.031,36.5,0.06284,0.23144,1230625024,4421000192,0.09,0.04,0.32516998,0.23873,0.21471001,USD,1.5526,,,
366,PEP,700 Anderson Hill Road,Purchase,NY,10577,United States,914 253 2000,https://www.pepsico.com,Beverages - Non-Alcoholic,beverages-non-alcoholic,Beverages - Non - Alcoholic,Consumer Defensive,consumer-defensive,Consumer Defensive,"PepsiCo, Inc. engages in the manufacture, marketing, distribution, and sale of various beverages and convenient foods worldwide. The company operates through seven segments: Frito-Lay North America; Quaker Foods North America; PepsiCo Beverages North America; Latin America; Europe; Africa, Middle East and South Asia; and Asia Pacific, Australia and New Zealand and China Region. It provides dips, cheese-flavored snacks, and spreads, as well as corn, potato, and tortilla chips; cereals, rice, pasta, mixes and syrups, granola bars, grits, oatmeal, rice cakes, and side dishes; beverage concentrates, fountain syrups, and finished goods; ready-to-drink tea, coffee, and juices; dairy products; and sparkling water makers and related products, as well as distributes alcoholic beverages under Hard MTN Dew brand. The company offers its products primarily under the Lay's, Doritos, Fritos, Tostitos, BaiCaoWei, Cheetos, Cap'n Crunch, Life, Pearl Milling Company, Gatorade, Pepsi-Cola, Mountain Dew, Quaker, Rice-A-Roni, Aquafina, Bubly, Emperador, Diet Mountain Dew, Diet Pepsi, Gatorade Zero, Crush, Propel, Dr Pepper, Schweppes, Marias Gamesa, Ruffles, Sabritas, Saladitas, Tostitos, 7UP, Diet 7UP, H2oh!, Manzanita Sol, Mirinda, Pepsi Black, Pepsi Max, San Carlos, Toddy, Walkers, Chipsy, Kurkure, Sasko, Spekko, White Star, Smith's, Sting, SodaStream, Lubimyj Sad, Agusha, Chudo, Domik v Derevne, Lipton, and other brands. It serves wholesale and other distributors, foodservice customers, grocery stores, drug stores, convenience stores, discount/dollar stores, mass merchandisers, membership stores, hard discounters, e-commerce retailers and authorized independent bottlers, and others through a network of direct-store-delivery, customer warehouse, and distributor networks, as well as directly to consumers through e-commerce platforms and retailers. The company was founded in 1898 and is based in Purchase, New York.",318000,"{'maxAge': 1, 'name': 'Mr. Ramon Luis Laguarta', 'age': 59, 'title': 'Chairman & CEO', 'yearBorn': 1964, 'fiscalYear': 2022, 'totalPay': 14731512, 'exercisedValue': 0, 'unexercisedValue': 0}",8,7,6,3,6,1709251200,1672444800,86400,2,164.59,164.45,163.6,165.52,164.59,164.45,163.6,165.52,5.06,0.0307,1709164800,0.7538,2.74,0.534,25.128996,18.69734,2245740,2245740,5623633,5678610,5678610,164.36,164.36,900,900,226956247040,155.83,196.88,2.4811823,168.4236,174.4355,4.945,0.030044354,USD,263409319936,0.0992,1368203106,1374429952,14368324,15588153,1705017600,1707955200,0.0105,0.00151,0.76956004,2.43,0.0105,1374680064,13.467,12.259412,1703894400,1735516800,1703894400,1.514,9073999872,6.57,8.83,2.94,2:1,833328000,2.88,16.132,-0.051354468,0.2689098,1.265,1709164800,NMS,EQUITY,PEP,PEP,"Pepsico, Inc.","PepsiCo, Inc.",76253400,America/New_York,EST,06e446cd-76a5-3a81-a6f5-7333bc200639,finmb_32854,-18000000,165.0975,210.0,151.0,186.78,185.81,2.3,buy,20,10003000320,7.278,16327999488,47061000192,0.658,0.852,91471003648,252.514,66.476,0.08783,0.50988996,7260000256,13441999872,1.521,-0.005,0.54228,0.1785,0.09828,USD,2.4504,,,
367,PFE,66 Hudson Boulevard East,New York,NY,10001-2192,United States,212 733 2323,https://www.pfizer.com,Drug Manufacturers - General,drug-manufacturers-general,Drug Manufacturers - General,Healthcare,healthcare,Healthcare,"Pfizer Inc. discovers, develops, manufactures, markets, distributes, and sells biopharmaceutical products in the United States, Europe, and internationally. The company offers medicines and vaccines in various therapeutic areas, including cardiovascular metabolic, migraine, and women's health under the Eliquis, Nurtec ODT/Vydura, Zavzpret, and the Premarin family brands; infectious diseases with unmet medical needs under the Prevnar family, Abrysvo, Nimenrix, FSME/IMMUN-TicoVac, and Trumenba brands; and COVID-19 prevention and treatment, and potential future mRNA and antiviral products under the Comirnaty and Paxlovid brands. It also provides medicines and vaccines in various therapeutic areas, such as biosimilars for chronic immune and inflammatory diseases under the Xeljanz, Enbrel, Inflectra, Litfulo, Velsipity, and Cibinqo brands; amyloidosis, hemophilia, endocrine diseases, and sickle cell disease under the Vyndaqel family, Oxbryta, BeneFIX, Somavert, Ngenla, and Genotropin brands; sterile injectable and anti-infective medicines under the Sulperazon, Medrol, Zavicefta, Zithromax, and Panzyga brands; and biologics, small molecules, immunotherapies, and biosimilars under the Ibrance, Xtandi, Inlyta, Bosulif, Mektovi, Padcev, Adcetris, Talzenna, Tukysa, Elrexfio, Tivdak, Lorbrena, and Braftovi brands. In addition, the company involved in the contract manufacturing business. It serves wholesalers, retailers, hospitals, clinics, government agencies, pharmacies, individual provider offices, retail pharmacies, and integrated delivery systems. The company has collaboration agreements with Bristol-Myers Squibb Company; Astellas Pharma US, Inc.; Merck KGaA; and BioNTech SE. Pfizer Inc. was founded in 1849 and is headquartered in New York, New York.",88000,"{'maxAge': 1, 'name': 'Dr. Albert  Bourla D.V.M., Ph.D.', 'age': 61, 'title': 'Chairman of the Board & CEO', 'yearBorn': 1962, 'fiscalYear': 2022, 'totalPay': 11721071, 'exercisedValue': 0, 'unexercisedValue': 16848308}",10,6,3,1,5,1709251200,1672444800,86400,2,26.59,26.3,25.61,26.45,26.59,26.3,25.61,26.45,1.68,0.063200004,1706140800,4.4323997,3.92,0.557,69.78378,9.423358,62617366,62617366,46809205,37880710,37880710,25.69,25.7,3100,3000,145799856128,25.61,42.22,2.4924757,27.946,32.62185,1.64,0.06167732,USD,213063843840,0.03622,5635710739,5646779904,60680875,57575039,1705017600,1707955200,0.0107,0.00046,0.70128,1.35,0.0107,5646779904,15.766,1.6377014,1703980800,1735603200,1703980800,,2134000000,0.37,2.74,-10.29,1054:1000,1605571200,3.642,18.5,-0.3531987,0.2689098,0.42,1706140800,NYQ,EQUITY,PFE,PFE,"Pfizer, Inc.",Pfizer Inc.,76253400,America/New_York,EST,72e0dcbd-2b61-3bbf-a98a-8b2df7c4850c,finmb_162270,-18000000,25.82,50.0,26.0,32.28,31.44,2.4,buy,23,12689999872,2.247,11516999680,75332001792,0.583,0.907,58496000000,84.37,10.366,0.01551,0.02347,1024249984,8700000256,,-0.413,0.5899,0.19689,-0.49967998,USD,0.2627,,,
370,PSX,2331 CityWest Boulevard,Houston,TX,77042,United States,832 765 3010,https://www.phillips66.com,Oil & Gas Refining & Marketing,oil-gas-refining-marketing,Oil & Gas Refining & Marketing,Energy,energy,Energy,"Phillips 66 operates as an energy manufacturing and logistics company in the United States, the United Kingdom, Germany, and internationally. It operates through four segments: Midstream, Chemicals, Refining, and Marketing and Specialties (M&S). The Midstream segment transports crude oil and other feedstocks; delivers refined petroleum products to market; provides terminaling and storage services for crude oil and refined petroleum products; transports, stores, fractionates, exports, and markets natural gas liquids; provides other fee-based processing services; and gathers, processes, transports, and markets natural gas. The Chemicals segment produces and markets ethylene and other olefin products; aromatics and styrenics products, such as benzene, cyclohexane, styrene, and polystyrene; and various specialty chemical products, including organosulfur chemicals, solvents, catalysts, and chemicals used in drilling and mining. The Refining segment refines crude oil and other feedstocks into petroleum products, such as gasolines, distillates, aviation, and renewable. The M&S segment purchases for resale and markets refined petroleum products, including gasolines, distillates, and aviation fuels. This segment also manufactures and markets specialty products, such as base oils and lubricants. Phillips 66 was founded in 1875 and is headquartered in Houston, Texas.",14000,"{'maxAge': 1, 'name': 'Mr. Greg C. Garland', 'age': 66, 'title': 'Executive Chairman', 'yearBorn': 1957, 'fiscalYear': 2022, 'totalPay': 5903707, 'exercisedValue': 7265523, 'unexercisedValue': 16385566}",9,5,9,9,9,1709251200,1672444800,86400,2,144.2,143.31,143.06,145.99,144.2,143.31,143.06,145.99,4.2,0.0291,1708041600,0.2713,4.3,1.356,9.364106,10.079917,1931443,1931443,3161568,2611850,2611850,145.33,145.39,800,2200,62055870464,89.74,150.08,0.42100605,138.6724,117.52045,4.2,0.029126212,USD,79947284480,0.04759,425039292,427824000,9299835,8852695,1705017600,1707955200,0.0217,0.00399,0.78206,2.77,0.0247,427824000,71.046,2.041635,1703980800,1735603200,1703980800,-0.331,7004000256,15.49,14.39,-0.98,,,0.542,7.997,0.38680518,0.2689098,1.05,1708041600,NYQ,EQUITY,PSX,PSX,Phillips 66,Phillips 66,1334237400,America/New_York,EST,6fbece3e-56c2-320b-b268-a2144205769e,finmb_27306532,-18000000,145.05,169.0,135.0,151.42,150.0,2.1,buy,16,3323000064,7.767,9996999680,20511000576,0.949,1.258,147399000064,64.806,327.454,0.06598,0.22017999,2446000128,7029000192,-0.28,-0.05,0.13103,0.06782,0.04319,USD,,,,
372,PXD,777 Hidden Ridge,Irving,TX,75038,United States,972 444 9001,https://www.pxd.com,Oil & Gas E&P,oil-gas-e-p,Oil & Gas E&P,Energy,energy,Energy,"Pioneer Natural Resources Company operates as an independent oil and gas exploration and production company in the United States. The company explores for, develops, and produces oil, natural gas liquids (NGLs), and gas. It has operations in the Midland Basin in West Texas. The company was founded in 1997 and is headquartered in Irving, Texas.",2213,"{'maxAge': 1, 'name': 'Mr. Richard P. Dealy', 'age': 57, 'title': 'CEO, President & Director', 'yearBorn': 1966, 'fiscalYear': 2022, 'totalPay': 1834803, 'exercisedValue': 0, 'unexercisedValue': 0}",9,3,2,8,6,1709251200,1672444800,86400,2,237.27,237.49,234.53,237.36,237.27,237.49,234.53,237.36,10.94,0.0461,1709251200,0.6907,4.03,1.329,11.633868,11.320346,1151484,1151484,2281413,2690090,2690090,235.08,235.13,1000,1300,54956728320,177.27,257.76,2.8366227,227.749,226.0701,13.96,0.058835924,USD,60812759040,0.25261,231345296,233623008,6615971,5197928,1705017600,1707955200,0.028299998,0.0069199996,0.82054,3.07,0.028499998,233623008,99.181,2.371793,1703980800,1735603200,1703980800,-0.143,4885000192,20.22,20.78,6.01,,,3.139,6.54,0.13206732,0.2689098,2.56,1709251200,NYQ,EQUITY,PXD,PXD,Pioneer Natural Resources Compa,Pioneer Natural Resources Company,871047000,America/New_York,EST,45d9eec3-b269-3316-bcbd-b145de6455e5,finmb_295224,-18000000,235.2368,306.0,220.0,251.86,245.0,2.9,hold,22,379000000,1.622,9297999872,5760000000,0.662,0.876,19374000128,24.859,82.795,0.1109,0.21412,2514249984,8448000000,-0.119,-0.019,0.51418996,0.47992,0.34160998,USD,,,,
373,PNC,The Tower at PNC Plaza,Pittsburgh,PA,15222-2401,United States,888 762 2265,https://www.pnc.com,Banks - Regional,banks-regional,Banks - Regional,Financial Services,financial-services,Financial Services,"The PNC Financial Services Group, Inc. operates as a diversified financial services company in the United States. It operates through three segments: Retail Banking, Corporate & Institutional Banking, and Asset Management Group segments. The company's Retail Banking segment offers checking, savings, and money market accounts, as well as time deposit; residential mortgages, home equity loans and lines of credit, auto loans, credit cards, education loans, and personal and small business loans and lines of credit; and brokerage, insurance, and investment and cash management services. This segment serves consumer and small business customers through a network of branches, digital channels, ATMs, and through phone-based customer contact centers. Its Corporate & Institutional Banking segment provides secured and unsecured loans, letters of credit, and equipment leases; cash and investment management services, receivables and disbursement management services, funds transfer services, international payment services, and access to online/mobile information management and reporting; securities underwriting, loan syndications, customer-related trading, and mergers and acquisitions and equity capital markets advisory related services; and commercial loan servicing and technology solutions. It serves mid-sized and large corporations, and government and not-for-profit entities. The company's Asset Management Group segment offers investment and retirement planning, customized investment management, credit and cash management solutions, and trust management and administration services for high net worth and ultra high net worth individuals, and their families; and multi-generational family planning services for ultra high net worth individuals and their families. It also provides outsourced chief investment officer, custody, private real estate, cash and fixed income client solutions, and retirement plan fiduciary investment services for institutional clients. The company was founded in 1852 and is headquartered in Pittsburgh, Pennsylvania.",54813,"{'maxAge': 1, 'name': 'Mr. William S. Demchak', 'age': 61, 'title': 'Chairman & CEO', 'yearBorn': 1962, 'fiscalYear': 2022, 'totalPay': 4473475, 'exercisedValue': 0, 'unexercisedValue': 0}",1,6,2,5,2,1709251200,1672444800,86400,2,147.81,150.99,150.34,156.385,147.81,150.99,150.34,156.385,6.15,0.0416,1705017600,0.47689998,3.45,1.157,12.038311,10.896674,3802007,3802007,2181751,1887780,1887780,153.96,154.08,800,800,61250498560,109.4,157.69,2.952116,150.191,131.55005,6.1,0.041269198,USD,133214019584,0.26885,393706710,397808000,5066587,6059599,1705017600,1707955200,0.0127,0.00365,0.84706,2.23,0.0128,397808000,112.724,1.3659025,1703980800,1735603200,1703980800,-0.435,5126000128,12.79,14.13,1.06,2:1,721872000,6.421,,-0.03189677,0.2689098,1.55,1705017600,NYQ,EQUITY,PNC,PNC,"PNC Financial Services Group, I","The PNC Financial Services Group, Inc.",185466600,America/New_York,EST,75d3d3f2-357a-3484-9613-24827c7dcdde,finmb_294585,-18000000,153.97,199.0,141.0,163.36,163.44,2.4,buy,20,10136000512,25.48,,78273003520,,,20747999232,,51.741,0.010089999,0.11649,,10110999552,-0.464,-0.042,,,0.20569,USD,3.8221,300 Fifth Avenue,,
381,PRU,751 Broad Street,Newark,NJ,07102,United States,973 802 6000,https://www.prudential.com,Insurance - Life,insurance-life,Insurance - Life,Financial Services,financial-services,Financial Services,"Prudential Financial, Inc., together with its subsidiaries, provides insurance, investment management, and other financial products and services in the United States and internationally. It operates through PGIM, Retirement Strategies, Group Insurance, Individual Life, and International Businesses segments. The PGIM segment offers investment management services and solutions related to public fixed income, public equity, real estate debt and equity, private credit and other alternatives, and multi-asset class strategies to institutional and retail clients, as well as its general account. The Retirement Strategies segment provides a range of retirement investment, and income products and services to retirement plan sponsors in the public, private, and not-for-profit sectors; develops and distributes individual variable and fixed annuity products. The Group Insurance segment offers various group life, and long-term and short-term group disability, as well as group corporate-, bank-, and trust-owned life insurance in the United States primarily for institutional clients for use in connection with employee and membership benefits plans; sells accidental death and dismemberment, and other supplemental health solutions; and plan administration services in connection with its insurance coverages. The Individual Life segment develops and distributes variable life, universal life, and term life insurance products. The International Businesses segment develops and distributes life insurance, retirement products, investment products, and certain accident and health products; and advisory services. The company provides its products and services to individual and institutional customers through its proprietary and third-party distribution networks. Prudential Financial, Inc. was founded in 1875 and is headquartered in Newark, New Jersey.",40366,"{'maxAge': 1, 'name': 'Mr. Charles Frederick Lowrey Jr.', 'age': 65, 'title': 'Chairman, CEO & President', 'yearBorn': 1958, 'fiscalYear': 2022, 'totalPay': 6577154, 'exercisedValue': 0, 'unexercisedValue': 731525}",2,4,1,1,1,1709251200,1672444800,86400,2,108.01,107.6,106.64,108.3,108.01,107.6,106.64,108.3,5.2,0.0481,1708041600,0.7418,4.99,1.358,15.897627,7.364261,810636,810636,1709770,1453950,1453950,107.26,107.28,1000,1200,38489993216,75.37,110.12,0.71305496,105.1192,95.5237,5.0,0.04629201,USD,40246591488,0.046090003,357467070,359216000,5765993,6292888,1705017600,1707955200,0.0161,0.0014200001,0.58474,3.32,0.0161,359216000,77.446,1.3835447,1703980800,1735603200,1703980800,,2459000064,6.74,14.55,0.67,,,0.746,12.269,0.09588063,0.2689098,1.3,1708041600,NYQ,EQUITY,PRU,PRU,"Prudential Financial, Inc.","Prudential Financial, Inc.",1008253800,America/New_York,EST,e7888e2d-0c76-30a5-b916-8b298017a4d2,finmb_1038328,-18000000,107.15,117.0,99.0,108.4,110.5,3.0,hold,10,34214000640,95.304,3280333312,33717999616,1.094,1.232,53979000832,113.197,148.498,0.00291,0.08129,2623375104,6510000128,,0.561,0.30012,0.06077,0.23973,USD,0.4233,,,
