,ticker,address1,city,state,zip,country,phone,website,industry,industryKey,industryDisp,sector,sectorKey,sectorDisp,longBusinessSummary,fullTimeEmployees,companyOfficers,auditRisk,boardRisk,compensationRisk,shareHolderRightsRisk,overallRisk,governanceEpochDate,compensationAsOfEpochDate,maxAge,priceHint,previousClose,open,dayLow,dayHigh,regularMarketPreviousClose,regularMarketOpen,regularMarketDayLow,regularMarketDayHigh,dividendRate,dividendYield,exDividendDate,payoutRatio,fiveYearAvgDividendYield,beta,trailingPE,forwardPE,volume,regularMarketVolume,averageVolume,averageVolume10days,averageDailyVolume10Day,bid,ask,bidSize,askSize,marketCap,fiftyTwoWeekLow,fiftyTwoWeekHigh,priceToSalesTrailing12Months,fiftyDayAverage,twoHundredDayAverage,trailingAnnualDividendRate,trailingAnnualDividendYield,currency,enterpriseValue,profitMargins,floatShares,sharesOutstanding,sharesShort,sharesShortPriorMonth,sharesShortPreviousMonthDate,dateShortInterest,sharesPercentSharesOut,heldPercentInsiders,heldPercentInstitutions,shortRatio,shortPercentOfFloat,impliedSharesOutstanding,bookValue,priceToBook,lastFiscalYearEnd,nextFiscalYearEnd,mostRecentQuarter,earningsQuarterlyGrowth,netIncomeToCommon,trailingEps,forwardEps,pegRatio,lastSplitFactor,lastSplitDate,enterpriseToRevenue,enterpriseToEbitda,52WeekChange,SandP52WeekChange,lastDividendValue,lastDividendDate,exchange,quoteType,symbol,underlyingSymbol,shortName,longName,firstTradeDateEpochUtc,timeZoneFullName,timeZoneShortName,uuid,messageBoardId,gmtOffSetMilliseconds,currentPrice,targetHighPrice,targetLowPrice,targetMeanPrice,targetMedianPrice,recommendationMean,recommendationKey,numberOfAnalystOpinions,totalCash,totalCashPerShare,ebitda,totalDebt,quickRatio,currentRatio,totalRevenue,debtToEquity,revenuePerShare,returnOnAssets,returnOnEquity,freeCashflow,operatingCashflow,earningsGrowth,revenueGrowth,grossMargins,ebitdaMargins,operatingMargins,financialCurrency,trailingPegRatio,address2,fax,industrySymbol
0,MMM,3M Center,Saint Paul,MN,55144-1000,United States,651 733 1110,https://www.3m.com,Conglomerates,conglomerates,Conglomerates,Industrials,industrials,Industrials,"3M Company provides diversified technology services in the United States and internationally. The company operates through four segments: Safety and Industrial; Transportation and Electronics; Health Care; and Consumer. The Safety and Industrial segment offers industrial abrasives and finishing for metalworking applications; autobody repair solutions; closure systems for personal hygiene products, masking, and packaging materials; electrical products and materials for construction and maintenance, power distribution, and electrical original equipment manufacturers; structural adhesives and tapes; respiratory, hearing, eye, and fall protection solutions; and natural and color-coated mineral granules for shingles. The Transportation and Electronics segment provides ceramic solutions; attachment/bonding products, films, sound, and temperature management for transportation vehicles; premium large format graphic films for advertising and fleet signage; light management films and electronics assembly solutions; packaging and interconnection solutions; semiconductor production materials; data centers solutions; and reflective signage for highway, and vehicle safety. The Healthcare segment offers health care procedure coding and reimbursement software; skin, wound care, and infection prevention products and solutions; dentistry and orthodontia solutions; and filtration and purification systems. The Consumer segment provides consumer bandages, braces, supports, and consumer respirators; home cleaning products; retail abrasives, paint accessories, car care DIY products, picture hanging, and consumer air quality solutions; and stationery products. It offers its products through e-commerce and traditional wholesalers, retailers, jobbers, distributors, and dealers. 3M Company was founded in 1902 and is headquartered in Saint Paul, Minnesota.",85000,"{'maxAge': 1, 'name': 'Mr. Michael F. Roman', 'age': 63, 'title': 'Chairman & CEO', 'yearBorn': 1960, 'fiscalYear': 2022, 'totalPay': 3030438, 'exercisedValue': 474479, 'unexercisedValue': 0}",4,8,7,4,6,1709251200,1672444800,86400,2,91.86,91.1,90.4765,91.76,91.86,91.1,90.4765,91.76,6.04,0.065799996,1707955200,0.6167,4.18,1.0,,8.949019,3016326,3016326,4119411,3667340,3667340,91.28,91.29,900,1100,50450456576,85.35,113.14,1.5437243,99.754,99.17975,6.0,0.06531679,USD,61788020736,-0.21404,551671978,552700032,6075186,7033985,1705017600,1707955200,0.011,0.00112,0.66913,1.16,0.011,554484992,8.699,10.493159,1703980800,1735603200,1703980800,0.747,-6994999808,-12.63,10.2,2.34,2:1,1064880000,1.891,7.85,-0.16437733,0.2689098,1.51,1707955200,NYQ,EQUITY,MMM,MMM,3M Company,3M Company,-252322200,America/New_York,EST,375388b3-dab7-3763-90cd-457ad19388a2,finmb_289194,-18000000,91.28,111.57,85.0,103.85,105.0,3.1,hold,13,5985999872,10.83,7871000064,16942000128,0.709,1.071,32681000960,348.028,59.002,0.0758,-0.71075994,8937749504,6680000000,0.744,-0.008,0.43772,0.24084,0.12642,USD,2.0519,,,
3,ABBV,1 North Waukegan Road,North Chicago,IL,60064-6400,United States,847 932 7900,https://www.abbvie.com,Drug Manufacturers - General,drug-manufacturers-general,Drug Manufacturers - General,Healthcare,healthcare,Healthcare,"AbbVie Inc. discovers, develops, manufactures, and sells pharmaceuticals worldwide. The company offers Humira, a therapy administered as an injection for autoimmune, intestinal Behçet's diseases, and pyoderma gangrenosum; Skyrizi to treat moderate to severe plaque psoriasis, psoriatic disease, and Crohn's disease; Rinvoq to treat rheumatoid and psoriatic arthritis, ankylosing spondylitis, atopic dermatitis, axial spondyloarthropathy, ulcerative colitis, and Crohn's disease; Imbruvica for the treatment of adult patients with blood cancers; Epkinly to treat lymphoma; Elahere to treat cancer; and Venclexta/Venclyxto to treat blood cancers. It also provides facial injectables, plastics and regenerative medicine, body contouring, and skincare products; botox therapeutic; Vraylar for depressive disorder; Duopa and Duodopa to treat advanced Parkinson's disease; Ubrelvy for the acute treatment of migraine with or without aura in adults; and Qulipta for episodic and chronic migraine. In addition, the company offers Ozurdex for eye diseases; Lumigan/Ganfort and Alphagan/Combigan for the reduction of elevated intraocular pressure in patients with open angle glaucoma or ocular hypertension; Restasis, a calcineurin inhibitor immunosuppressant indicated to increase tear production; and other eye care products. Further, it provides Mavyret/Maviret to treat chronic hepatitis C virus genotype 1-6 infection; Creon, a pancreatic enzyme therapy; Lupron to treat advanced prostate cancer, endometriosis and central precocious puberty, and patients with anemia caused by uterine fibroids; Linzess/Constella to treat irritable bowel syndrome with constipation and chronic idiopathic constipation; and Synthroid for hypothyroidism. It has collaborations with Calico Life Sciences LLC; REGENXBIO Inc.; Janssen Biotech, Inc.; and Genentech, Inc., as well as collaboration with Tentarix Biotherapeutics, LP to develop conditionally-active and multi-specific biologics for oncology and immunology. The company was incorporated in 2012 and is headquartered in North Chicago, Illinois.",50000,"{'maxAge': 1, 'name': 'Mr. Richard A. Gonzalez', 'age': 69, 'title': 'Chairman & CEO', 'yearBorn': 1954, 'fiscalYear': 2022, 'totalPay': 6948244, 'exercisedValue': 0, 'unexercisedValue': 43528872}",7,5,6,9,8,1709251200,1672444800,86400,2,178.91,178.35,176.7,179.98,178.91,178.35,176.7,179.98,6.2,0.0347,1712880000,2.1764998,4.45,0.555,65.08456,14.498772,2318135,2318135,5385903,4884830,4884830,176.96,176.97,800,1200,312718196736,130.96,179.98,5.7571745,166.7646,149.7582,5.99,0.033480518,USD,363839750144,0.08953,1760855974,1766470016,14748988,13561430,1705017600,1707955200,0.0083,0.00153,0.72055,2.83,0.0084,1766470016,5.867,30.173853,1703980800,1735603200,1703980800,-0.668,4819999744,2.72,12.21,4.87,,,6.698,13.804,0.15217674,0.2689098,1.55,1705017600,NYQ,EQUITY,ABBV,ABBV,AbbVie Inc.,AbbVie Inc.,1357137000,America/New_York,EST,73238d42-cdcc-3f92-8141-dd675addae10,finmb_141885706,-18000000,177.03,206.0,153.0,181.38,180.0,2.2,buy,24,12816000000,7.255,26357999616,60579000320,0.633,0.872,54317998080,582.658,30.723,0.08071,0.35204,22628499456,22838999040,-0.669,-0.054,0.69207,0.48525003,0.31809,USD,0.4911,,,
10,APD,1940 Air Products Boulevard,Allentown,PA,18106-5500,United States,610 481 4911,https://www.airproducts.com,Specialty Chemicals,specialty-chemicals,Specialty Chemicals,Basic Materials,basic-materials,Basic Materials,"Air Products and Chemicals, Inc. provides atmospheric gases, process and specialty gases, equipment, and related services in the Americas, Asia, Europe, the Middle East, India, and internationally. The company produces atmospheric gases, including oxygen, nitrogen, and argon; process gases, such as hydrogen, helium, carbon dioxide, carbon monoxide, and syngas; and specialty gases for customers in various industries, including refining, chemical, manufacturing, electronics, energy production, medical, food, and metals. It also designs and manufactures equipment for air separation, hydrocarbon recovery and purification, natural gas liquefaction, and liquid helium and liquid hydrogen transport and storage. The company was founded in 1940 and is headquartered in Allentown, Pennsylvania.",23000,"{'maxAge': 1, 'name': 'Mr. Seifollah  Ghasemi', 'age': 79, 'title': 'Chairman, President & CEO', 'yearBorn': 1944, 'fiscalYear': 2023, 'totalPay': 4991795, 'exercisedValue': 0, 'unexercisedValue': 33339660}",3,5,10,3,7,1709251200,1703980800,86400,2,236.0,235.4,235.7244,239.28,236.0,235.4,235.7244,239.28,7.02,0.0297,1711584000,0.6692,2.19,0.821,22.745598,17.711737,1140073,1140073,1711393,1798800,1798800,237.21,237.35,800,1000,52839055360,212.24,307.71,4.2534275,250.668,275.857,7.0,0.029661017,USD,64278749184,0.18815,220878324,222300992,2759856,2189147,1705017600,1707955200,0.0124,0.0032,0.85820997,1.18,0.0125,222300992,66.905,3.5526717,1696032000,1727654400,1703980800,0.065,2329900032,10.45,13.42,2.78,1081:1000,1475452800,5.174,15.868,-0.19486898,0.2689098,1.75,1703808000,NYQ,EQUITY,APD,APD,"Air Products and Chemicals, Inc","Air Products and Chemicals, Inc.",322151400,America/New_York,EST,7dc5e22e-aca5-37c1-965b-43839084afc6,finmb_248356,-18000000,237.6915,355.0,210.0,268.16,260.0,2.4,buy,19,2243500032,10.092,4050800128,12803099648,1.466,1.811,12422700032,79.379,55.864,0.053379998,0.1546,-2326024960,3113600000,0.062,-0.056,0.30547002,0.32608002,0.21521999,USD,1.3829,,,
26,AEP,1 Riverside Plaza,Columbus,OH,43215-2373,United States,614 716 1000,https://www.aep.com,Utilities - Regulated Electric,utilities-regulated-electric,Utilities - Regulated Electric,Utilities,utilities,Utilities,"American Electric Power Company, Inc., an electric public utility holding company, engages in the generation, transmission, and distribution of electricity for sale to retail and wholesale customers in the United States. It operates through Vertically Integrated Utilities, Transmission and Distribution Utilities, AEP Transmission Holdco, and Generation & Marketing segments. The company generates electricity using coal and lignite, natural gas, renewable, nuclear, hydro, solar, wind, and other energy sources. It also supplies and markets electric power at wholesale to other electric utility companies, rural electric cooperatives, municipalities, and other market participants. American Electric Power Company, Inc. was incorporated in 1906 and is headquartered in Columbus, Ohio.",17250,"{'maxAge': 1, 'name': 'Mr. Benjamin Gwynn Stonestreet Fowke III', 'age': 65, 'title': 'Interim President, Interim CEO & Director', 'yearBorn': 1958, 'fiscalYear': 2022, 'totalPay': 122638, 'exercisedValue': 0, 'unexercisedValue': 0}",6,1,1,6,2,1709251200,1672444800,86400,2,84.99,84.62,84.38,85.435,84.99,84.62,84.38,85.435,3.52,0.0414,1707350400,0.7615,3.42,0.509,19.449541,14.2281885,2087232,2087232,4030620,5967970,5967970,84.99,85.01,1000,900,44620488704,69.38,96.05,2.3506367,80.406,80.4321,3.37,0.03965172,USD,88029331456,0.11632,524106156,526184992,8638043,8487629,1705017600,1707955200,0.0164,0.00039,0.78412,2.25,0.0164,526184992,47.981,1.7673664,1703980800,1735603200,1703980800,-0.125,2208100096,4.36,5.96,2.8,2:1,-226281600,4.637,12.612,-0.04900974,0.2689098,0.88,1707350400,NMS,EQUITY,AEP,AEP,American Electric Power Company,"American Electric Power Company, Inc.",-252322200,America/New_York,EST,31a5c29e-9305-3849-a05f-4a7df17372c6,finmb_135470,-18000000,84.8,99.0,75.5,86.53,87.0,2.5,buy,16,544400000,1.035,6979700224,43814100992,0.272,0.525,18982299648,173.275,36.582,0.026010001,0.08956,-3047262464,5012199936,-0.155,-0.062,0.43816003,0.3677,0.16274,USD,2.4935,,,
33,AMGN,One Amgen Center Drive,Thousand Oaks,CA,91320-1799,United States,805 447 1000,https://www.amgen.com,Drug Manufacturers - General,drug-manufacturers-general,Drug Manufacturers - General,Healthcare,healthcare,Healthcare,"Amgen Inc. discovers, develops, manufactures, and delivers human therapeutics worldwide. The company's principal products include Enbrel to treat plaque psoriasis, rheumatoid arthritis, and psoriatic arthritis; Otezla for the treatment of adult patients with plaque psoriasis, psoriatic arthritis, and oral ulcers associated with Behçet's disease; Prolia to treat postmenopausal women with osteoporosis; XGEVA for skeletal-related events prevention; Repatha, which reduces the risks of myocardial infarction, stroke, and coronary revascularization; Nplate for the treatment of patients with immune thrombocytopenia; KYPROLIS to treat patients with relapsed or refractory multiple myeloma; Aranesp to treat a lower-than-normal number of red blood cells and anemia; EVENITY for the treatment of osteoporosis in postmenopausal for men and women; Vectibix to treat patients with wild-type RAS metastatic colorectal cancer; BLINCYTO for the treatment of patients with acute lymphoblastic leukemia; TEPEZZA to treat thyroid eye disease; and KRYSTEXXA for the treatment of chronic refractory gout. It also markets other products, including Neulasta, MVASI, AMJEVITA/AMGEVITA, TEZSPIRE, Parsabiv, Aimovig, LUMAKRAS/LUMYKRAS, EPOGEN, KANJINTI, TAVNEOS, RAVICTI, UPLIZNA and PROCYSBI. The company serves healthcare providers, including physicians or their clinics, dialysis centers, hospitals, and pharmacies. It distributes its products through pharmaceutical wholesale distributors, as well as direct-to-consumer channels. The company has collaboration agreements with AstraZeneca plc for the development and commercialization of TEZSPIRE; Novartis Pharma AG to develop and commercialize Aimovig; UCB for the development and commercialization of EVENITY; Kyowa Kirin Co., Ltd. for rocatinlimab development and commercialization; and BeiGene, Ltd. for oncology products expansion and development. Amgen Inc. was incorporated in 1980 and is headquartered in Thousand Oaks, California.",26700,"{'maxAge': 1, 'name': 'Mr. Robert A. Bradway', 'age': 60, 'title': 'Chairman, CEO & President', 'yearBorn': 1963, 'fiscalYear': 2022, 'totalPay': 5487475, 'exercisedValue': 0, 'unexercisedValue': 43693576}",2,8,2,1,2,1709251200,1672444800,86400,2,280.33,283.26,278.3,285.89,280.33,283.26,278.3,285.89,9.0,0.0321,1707955200,0.6821,2.97,0.578,22.309298,13.176527,1452142,1452142,2917755,3285280,3285280,280.62,280.73,800,900,149210578944,211.71,329.72,5.2930326,297.2714,263.05624,8.52,0.030392755,USD,204713148416,0.23828,533651964,535919008,11091634,8843256,1705017600,1707955200,0.0207,0.0023700001,0.80884004,3.45,0.0207,535919008,11.64,23.919245,1703980800,1735603200,1703980800,-0.525,6717000192,12.48,21.13,2.82,2:1,943228800,7.262,16.732,0.19233549,0.2689098,2.25,1707955200,NMS,EQUITY,AMGN,AMGN,Amgen Inc.,Amgen Inc.,424704600,America/New_York,EST,9376b97e-b428-3231-ba0b-142b20481cb4,finmb_24816,-18000000,278.42,380.0,170.0,307.59,321.0,2.4,buy,22,10944000000,20.421,12234999808,65422999552,1.027,1.649,28189999104,1049.791,52.692,0.06289,1.35793,3120624896,8471000064,-0.524,0.198,0.70149004,0.43402,0.081499994,USD,2.0345,,805 447 1010,
43,ADM,77 West Wacker Drive,Chicago,IL,60601,United States,312 634 8100,https://www.adm.com,Farm Products,farm-products,Farm Products,Consumer Defensive,consumer-defensive,Consumer Defensive,"Archer-Daniels-Midland Company procures, transports, stores, processes, and merchandises agricultural commodities, products, and ingredients in the United States, Switzerland, the Cayman Islands, Brazil, Mexico, Canada, the United Kingdom, and internationally. The company operates in three segments: Ag Services and Oilseeds, Carbohydrate Solutions, and Nutrition. It originates, merchandises, stores, and transports agricultural raw materials, such as oilseeds and soft seeds. The company also engages in the agricultural commodity and feed product import, export, and distribution; and structured trade finance activities. In addition, it offers vegetable oils and protein meals; ingredients for the food, feed, energy, and industrial customers; crude vegetable oils, salad oils, margarine, shortening, and other food products; and partially refined oils to produce biodiesel and glycols for use in chemicals, paints, and other industrial products. Further, the company provides peanuts, peanut-derived ingredients, and cotton cellulose pulp; sweeteners, corn and wheat starches, syrup, glucose, wheat flour, and dextrose; alcohol and other food and animal feed ingredients; ethyl alcohol and ethanol; corn gluten feed and meal; distillers' grains; and citric acids. Additionally, the company provides natural flavors, flavor systems, natural colors, proteins, emulsifiers, soluble fiber, polyols, hydrocolloids, probiotics, prebiotics, enzymes, and botanical extracts; and other specialty food and feed ingredients; edible beans; formula feeds, and animal health and nutrition products; and contract and private label pet treats and foods. It also offers futures commission merchant; commodity brokerage services; cash margins and securities pledged to commodity exchange clearinghouses; and cash pledged as security under certain insurance arrangements. The company was founded in 1902 and is headquartered in Chicago, Illinois.",40360,"{'maxAge': 1, 'name': 'Mr. Juan Ricardo Luciano', 'age': 62, 'title': 'Chairman, CEO & President', 'yearBorn': 1961, 'fiscalYear': 2022, 'totalPay': 7021919, 'exercisedValue': 44886648, 'unexercisedValue': 49593208}",5,5,2,5,4,1709251200,1672444800,86400,2,54.24,54.25,52.925,54.37,54.24,54.25,52.925,54.37,2.0,0.0369,1707264000,0.24340001,2.62,0.751,7.381085,9.102916,2509757,2509757,5811166,4340250,4340250,53.04,53.05,1000,900,28306528256,50.72,87.3,0.2921331,60.835,72.61295,1.75,0.03226401,USD,37285601280,0.04063,528175454,533380992,7197114,6448001,1705017600,1707955200,0.0135,0.00756,0.79086,0.79,0.0154,533380992,47.155,1.1254374,1672444800,1703980800,1696032000,-0.204,3936999936,7.19,5.83,-1.15,105:100,999129600,0.385,7.328,-0.33366096,0.2689098,0.5,1707264000,NYQ,EQUITY,ADM,ADM,Archer-Daniels-Midland Company,Archer-Daniels-Midland Company,322151400,America/New_York,EST,6fb4f229-92a0-3164-b772-67fde5477248,finmb_251704,-18000000,53.07,85.0,55.0,65.92,66.0,2.9,hold,13,1498000000,2.808,5088000000,9500000256,0.438,1.686,96896000000,37.137,177.141,0.04543,0.15824,2261625088,2020999936,-0.169,-0.121,0.07776,0.05251,0.04605,USD,,Suite 4600,,
47,T,208 South Akard Street,Dallas,TX,75202,United States,210 821 4105,https://www.att.com,Telecom Services,telecom-services,Telecom Services,Communication Services,communication-services,Communication Services,"AT&T Inc. provides telecommunications and technology services worldwide. The company operates through two segments, Communications and Latin America. The Communications segment offers wireless voice and data communications services; and sells handsets, wireless data cards, wireless computing devices, carrying cases/protective covers, and wireless chargers through its own company-owned stores, agents, and third-party retail stores. It also provides Virtual Private Networks, AT&T Dedicated Internet, Ethernet, data services, cloud solutions, outsourcing, and managed professional services, as well as customer premises equipment for multinational corporations, small and mid-sized businesses, governmental, and wholesale customers. In addition, this segment offers broadband services, including fiber connections, legacy telephony voice communication services, and other VoIP services and equipment to residential customers. This segment markets its communications services and products under the AT&T, AT&T Business, Cricket, AT&T PREPAID, and AT&T Fiber brand names. The Latin America segment provides postpaid and prepaid wireless services in Mexico under the AT&T and Unefon brand names, as well as sells smartphones through its owned stores, agents and third-party retail stores. The company was formerly known as SBC Communications Inc. and changed its name to AT&T Inc. in 2005. AT&T Inc. was incorporated in 1983 and is based in Dallas, Texas.",149900,"{'maxAge': 1, 'name': 'Mr. John T. Stankey', 'age': 60, 'title': 'CEO, President & Director', 'yearBorn': 1963, 'fiscalYear': 2022, 'totalPay': 8151219, 'exercisedValue': 0, 'unexercisedValue': 0}",2,2,3,3,1,1709251200,1672444800,86400,2,16.98,16.87,16.71,16.985,16.98,16.87,16.71,16.985,1.11,0.0654,1704758400,0.5635,7.13,0.694,8.516498,7.294565,17477653,17477653,40174550,33522380,33522380,16.75,16.76,2200,1400,120005935104,13.43,19.99,0.98021644,16.9578,15.7066,1.11,0.06537103,USD,292026417152,0.11762,7121820663,7152790016,94291995,90884033,1705017600,1707955200,0.013200001,0.00072999997,0.58597,2.15,0.013200001,7152790016,14.447,1.1613138,1703980800,1735603200,1703980800,,14192000000,1.97,2.3,9.75,1324:1000,1649635200,2.385,6.965,-0.09536493,0.2689098,0.278,1704758400,NYQ,EQUITY,T,T,AT&T Inc.,AT&T Inc.,438273000,America/New_York,EST,b9ece18c-950a-3bfa-ab0f-dbfa4ff731d3,finmb_100231,-18000000,16.7775,29.0,11.0,19.35,20.0,2.5,buy,22,6801999872,0.951,41925001216,161255997440,0.429,0.713,122427998208,135.038,17.049,0.04039,0.13833,6526875136,38314000384,,0.022,0.59059,0.34245,0.16386,USD,1.3217,,,
55,BKR,575 North Dairy Ashford Road,Houston,TX,77079-1121,United States,713 439 8600,https://www.bakerhughes.com,Oil & Gas Equipment & Services,oil-gas-equipment-services,Oil & Gas Equipment & Services,Energy,energy,Energy,"Baker Hughes Company provides a portfolio of technologies and services to energy and industrial value chain worldwide. The company operates through Oilfield Services & Equipment (OFSE) and Industrial & Energy Technology (IET) segments. The OFSE segment designs and manufactures products and provides related services, including exploration, appraisal, development, production, rejuvenation, and decommissioning for onshore and offshore oilfield operations. This segment also provides drilling services, drill bits, and drilling and completions fluids; completions, intervention, measurements, pressure pumping, and wireline services; artificial lift systems, and oilfield and industrial chemicals; subsea projects and services, flexible pipe systems, and surface pressure control systems; and integrated well services and solutions. It serves oil and natural gas companies; the United States and international independent oil and natural gas companies; national or state-owned oil companies; engineering, procurement, and construction contractors; geothermal companies; and other oilfield service companies. The IET segment provides gas technology equipment, including drivers, driven equipment, flow control, and turnkey solutions for the mechanical-drive, compression, and power-generation applications; and energy sectors, such as oil and gas, LNG operations, petrochemical, and carbon solutions. This segment also provides rack-based vibration monitoring equipment and sensors; integrated asset performance management products; inspection services; pumps, valves, and gears; precision sensors and instrumentation, and condition monitoring solutions. It serves upstream, midstream, downstream, onshore, offshore, and small and large scale customers. The company was formerly known as Baker Hughes, a GE company and changed its name to Baker Hughes Company in October 2019. Baker Hughes Company was incorporated in 2016 and is based in Houston, Texas.",58000,"{'maxAge': 1, 'name': 'Mr. Lorenzo  Simonelli', 'age': 50, 'title': 'Chairman, President & CEO', 'yearBorn': 1973, 'fiscalYear': 2022, 'totalPay': 4035326, 'exercisedValue': 0, 'unexercisedValue': 2313578}",2,5,8,2,3,1709251200,1672444800,86400,2,29.96,30.0,29.38,30.03,29.96,30.0,29.38,30.03,0.84,0.027999999,1707696000,0.4084,3.15,1.403,15.392671,11.620553,3020872,3020872,9093596,9050480,9050480,29.58,29.59,1400,900,29631672320,26.12,37.58,1.1617529,30.914,32.97195,0.78,0.026034713,USD,34280407040,0.07618,997208171,1000880000,21097391,16641012,1705017600,1707955200,0.0211,0.00141,0.97293,1.83,0.0319,7000000,15.399,1.9092149,1703980800,1735603200,1703980800,1.418,1943000064,1.91,2.53,0.49,,,1.344,9.183,-0.07158351,0.2689098,0.21,1707696000,NMS,EQUITY,BKR,BKR,Baker Hughes Company,Baker Hughes Company,544714200,America/New_York,EST,1b696385-7cd0-39c8-bb5b-bacf3c9bf05d,finmb_425005479,-18000000,29.4,49.0,34.0,40.46,40.0,2.0,buy,24,2646000128,2.644,3732999936,6789000192,0.748,1.255,25506000896,43.746,25.304,0.0465,0.13114001,2389250048,3062000128,1.366,0.157,0.20725,0.14636,0.11529,USD,0.8696,Suite 100,,
